Question,Answer,Context
Quel est le rôle du directeur de piste dans la gestion des vols par mauvaise visibilité ?,"D'après le texte, le directeur de piste joue un rôle crucial dans la gestion des vols par mauvaise visibilité.  Ses responsabilités incluent :

* **Décision d'appliquer les consignes de mauvaise visibilité :**  Il décide de la mise en place de ces consignes en fonction de la visibilité au sol et de la hauteur des nuages, en étroite collaboration avec un poste météorologique si disponible.  Il utilise des critères prédéfinis (visibilité horizontale inférieure à 1000 mètres ou hauteur de la base des nuages inférieure à 200 mètres par défaut).

* **Autorité dans la zone d'approche :** Il est l'autorité suprême concernant la circulation aérienne dans la zone d'approche (30 kilomètres de rayon autour de l'aérodrome), lorsque les consignes de mauvaise visibilité sont en vigueur.

* **Publication de l'avis d'application des consignes :** Il est responsable de la publication de l'avis (Q.B.I.) par des signaux visuels (panneaux) et un télégramme transmis aux différents acteurs (aérodromes, stations radio, autorités militaires...).  Il doit également annoncer la fin des consignes de la même manière.

* **Autorisation des départs et arrivées :** Il autorise les départs des aéronefs munis de radiocommunication et doit être informé des arrivées de ces mêmes aéronefs au moins 15 minutes avant leur entrée dans la zone d'approche.

* **Contrôle de la circulation dans la zone d'approche :** Il autorise l'entrée et l'atterrissage des aéronefs dans la zone d'approche, gère l'ordre des atterrissages, et donne les instructions nécessaires aux pilotes (hauteur, itinéraire...).  Il peut déléguer certaines tâches à la station aéronautique locale, mais garde le contrôle final.

* **Gestion des communications :** Il travaille en étroite collaboration avec la station aéronautique pour communiquer avec les aéronefs, notamment via le système d'abréviations Q-codes.  Il peut être physiquement présent à la station radiogoniomètre ou recevoir les informations par télétype ou téléphone.

En résumé, le directeur de piste est la figure centrale de la gestion des vols par mauvaise visibilité, assurant la sécurité et le bon déroulement des opérations aériennes dans des conditions difficiles.  Son rôle englobe la prise de décision, la communication, le contrôle de la circulation et la coordination avec les différents services impliqués.  La personne occupant ce poste varie selon la nature de l'aérodrome (mixte, civil ou militaire).
","### Context: ---  
**Bulletin officiel n° 1389 du 9 juin 1939**  
**EDITION DE TRADUCTION OFFICIELLE**  
****  
**Arrêté viziriel du 14 rebia I 1358 (4 mai 1939) relatif au vol des aéronefs
par mauvaise visibilité.** **Le Grand Vizir,** Vu le dahir du 1er octobre 1928
(16 rebia II 1347) relatif à la navigation aérienne et, notamment, ses
articles 81 et 82,  **Arrête :** **Article Premier :** Les vols des aéronefs
par mauvaise visibilité sont régis par les dispositions de l'instruction ci-
annexée.  **Article 2 :** Le présent arrêté entrera en vigueur le 1er juillet
1939.  Son exécution est laissée à la diligence des agents français mentionnés
à l'article 81 du dahir susvisé du 1er octobre 1928 (16 rebia II 1347). _Fait
à Rabat, le 14 rebia I 1358, (4 mai 1939).  
_**Mohamed El Mokri.** __ Vu pour promulgation et mise à exécution : _Rabat,
le 4 mai 1939.  
Le Commissaire Résident Général,  
_**Noguès.** ***** *** *** **Instruction sur le vol des aéronefs par mauvaise
visibilité.** **Article Premier :** _Définitions_ : _Consignes de mauvaise
visibilité_ : Lorsque la visibilité au sol ou la hauteur de la base inférieure
des nuages est insuffisante au-dessus d'un aérodrome ou dans son voisinage
immédiat, pour permettre la vue du terrain en des signaux éventuels, le
directeur de la piste (1), ou son remplaçant, peut décider de l'application de
consignes spéciales dites “consignes de mauvaise visibilité ”. _________ (1)
Voir annexe III. Pour éclairer sa décision, il se tient obligatoirement,
chaque fois qu'un poste météorologique existe sur l'aérodrome, en liaison
étroite avec lui. Dans le cas contraire, il peut entrer en liaison avec un
poste voisin. Les conditions d'application des consignes de mauvaise
visibilité sont, en principe, fixées de façon permanente pour chaque
aérodrome, et figurent en annexe pour les aérodromes les plus fréquentés. A
défaut d'indications contraires, on admettra comme conditions d'application
une visibilité horizontale inférieure à 1.000 mètres ou une hauteur au-dessus
du sol de la base inférieure des nuages inférieure à 200 mètres.  _Zone
d'approche_ : Une zone d'approche est une région délimitée autour d'un
aérodrome, lorsque les consignes de mauvaise visibilité sont en vigueur sur
celui-ci, et dans laquelle la circulation des aéronefs est soumise strictement
à l'autorité du directeur de la piste ou d'une personne désignée à cet effet.
A défaut d'indications contraires, elles sont limitées par une circonférence
de 30 kilomètres de rayon, ayant pour centre l'aérodrome, et n'ont pas de
limite en hauteur.  _Secteur d'approche_ : Un secteur d'approche d'un
aérodrome est un secteur déterminé d'avance, et spécialement favorable pour
l'approche de l'aérodrome par mauvaise visibilité.  _Axe de descente_ : Un axe
de descente en vue de l'atterrissage est un axe déterminé d'avance et
spécialement favorable pour la descente jusqu'à la vue du sol, par mauvaise
visibilité.  Les circonstances locales permettent de déterminer les tolérances
angulaires qui peuvent être admises de part et d'autre de l'axe de descente.
L'axe de descente est, en principe, la bissectrice du secteur d'approche.
_Avis d'application des consignes de mauvaise visibilité_ : Quand sur un
aérodrome les conditions de mauvaise visibilité justifient la mise en vigueur
des consignes de mauvaise visibilité, un avis spécial d'application de ces
consignes (Q. B. I.) est publié de la manière suivante :  1° Le jour, un
panneau carré rouge, d'au moins trois mètres de côté sera placé
horizontalement, à proximité du signal indiquant la direction du vent.  Une
pyramide triangulaire équilatérale jaune de 2 mètres de côté sera suspendue
par un de ses sommets à un mât.  La nuit, un panneau semblable sera placé dans
les mômes conditions, ses côtés seront dessinés par des lumières rouges.
D'autres panneaux rectangulaires (3 m. x 2 m.) jaunes avec deux lettres rouges
représentant le nom abrégé de l'aérodrome pourront être mis en des points
voisins des aérodromes importants, pour indiquer que les consignes de mauvaise
visibilité y sont en vigueur.  Les lettres rouges seront celles qui figurent
dans l'annexe 12 du règlement du service international des télécommunications
aéronautiques. Tous ces signaux sont supprimés lors de la cessation des
consignes de mauvaise visibilité ;  2° Un télégramme, avis d'application des
consignes de mauvaise visibilité, sera rédigé par le directeur de piste de
l'aérodrome intéressé et déposé par lui au bureau des télécommunications de
l'aérodrome ou, à défaut, téléphoné par ses soins au bureau de
télécommunications du réseau international le plus proche (1), ainsi qu'à
l'antenne du réseau radio de l'armée de l'air.  Sur ce télégramme, le
directeur de la piste met en adresse, comme destinataires, les aérodromes d'où
partent des aéronefs de lignes régulières à destination de son aérodrome, la
station radioélectrique C. N. B. (Casablanca-Goréa), la station centrale radio
goniométrique de la circonscription dans laquelle il se trouve et un certain
nombre d'aérodromes déterminés, indiqués en annexe.  Si un ou plusieurs de ces
destinataires ne possède pas de bureau du réseau international de
télécommunications, il appartient, au directeur de la piste de le prévenir par
téléphone ; son nom est alors supprimé de l'adresse du télégramme. Il lui
appartient également de prévenir par téléphone le commandant de la formation
militaire, s'il y en a une sur l'aérodrome, et, s'il n'en est pas lui-même le
commandant, et le commandant d'aérodrome civil (ou son remplaçant), s'il ne
l'est pas lui-même.  Le bureau de télécommunications qui reçoit le télégramme
en dépôt le transmet selon les règles habituelles à ses destinataires. En
outre, il le transmet à la station aéronautique de l'aérodrome. Celle-ci le
transmet sous forme de signal de sécurité avec accusé de réception aux
aéronefs qui, à sa connaissance, se dirigent vers l'aérodrome intéressé et, à
la station centrale de circonscription en lui indiquant à quels destinataires
elle a transmis le télégramme ou le signal. La station centrale de
circonscription contenant l'aérodrome intéressé en assure la transmission aux
autres aérodromes de la circonscription et des circonscriptions voisines,
munis d'un bureau de télécommunications aéronautiques.  Elle le transmet
également aux aéronefs survolant la circonscription non déjà prévenus, sous
forme de “ signal de sécurité ” avec accusé de réception.  La suppression des
consignes de mauvaise visibilité doit être communiquée aux mêmes
correspondants que leur mise en vigueur et de la même manière (2). Les
consignes de mauvaise visibilité cessent automatiquement à minuit. S'il y a
lieu de les prolonger, un nouveau télégramme doit être envoyé, identique au
télégramme d'avis d'application de ces consignes, prévu ci-dessus.  Lorsque la
station centrale de circonscription est confondue avec la station la plus
proche, celle-ci assume évidemment seule la totalité du service.  _________
(1) On utilisera le code international Q. B. L. Dijon. (2) On utilisera le
code international Q. B. L. Fin. Dijon  Tous les aérodromes prévenus sont
tenus de procéder à l'affichage immédiat.  La station C. N. B. répète le
télégramme toutes les heures aux heures rondes (H. + 00) sur 272 k.c/s,
pendant ses heures normales d'ouverture, sous forme d'avis aux navigateurs
urgents, tant que les consignes de brume sont appliquées.  Toutes les stations
radiotélégraphiques du réseau de l'armée du l'air écoutent sur cette fréquence
à chaque heure pendant trois minutes.  Au cas ou il y a application des
consignes de mauvaise visibilité sur un aérodrome quelconque, elles
préviennent l'autorité militaire de la base aérienne à laquelle elles sont
rattachées et transmettent le télégramme de mauvaise visibilité aux aéronefs
militaires qui, à leur connaissance, se dirigent vers l'aérodrome intéressé.
En outre, s'il y a sur l'aérodrome même où sont appliquées les consignes de
mauvaise visibilité une formation militaire, celle-ci diffuse l'avis aux
formations militaires voisines, conformément aux ordres spéciaux prévus,
indiqués en annexe.  **** **Article 2 :** _Vols par mauvaise visibilité en
dehors des zones d'approche_ : En plus des règles ordinaires, les aéronefs
sont astreints aux règles suivantes :  I. Aéronefs civils non munis
d'appareils de radiocommunication ou munis de ces appareils mais se trouvant
pour une raison quelconque dans l'impossibilité d'assurer le service
radioélectrique prévu par les règlements internationaux. Ces aéronefs sont
désignés dans le texte par l'expression “non munis d'appareils de
radiocommunication ou assimilés ”.  Ces aéronefs ne doivent pas entreprendre
une navigation susceptible de les obliger à entrer dans les nuages.  En cas de
mauvaise visibilité, il leur est expressément demandé de voler le plus bas
possible au-dessous des nuages.  Ils devront, autant que cola sera possible et
sans danger, voler suffisamment au-dessous des nuages pour qu'ils puissent
facilement voir et être vus.  II. _Aéronefs civils munis d'appareils de
radiocommunication_. Si un aéronef muni d'appareils de radiocommunication doit
procéder à un vol sans visibilité, dans une couche de nuage ou de brume, au-
dessus d'une telle couche, ou entre deux couches, il doit l'indiquer à la
station centrale de circonscription en utilisant les abréviations suivantes :
Q. B. F. Je vole dans les nuages à l'altitude de. ………………….. Q. B. N. Je vole
entre deux couches de nuages à l'altitude de …………… Q. B. G. le vole au-dessus
des nuages à l'altitude de…………………......  Cette indication, comme d'ailleurs
toutes les indications d'altitude, sauf Q.G.D., sera donnée en altitude au-
dessus du niveau de la mer, ou de préférence en pression barométrique absolue
(milibars), conformément à la note +) de la page 2. de l'annexe XI du R. S. I.
T. A.  Il précisera en outre, sa route, sa position et sa vitesse si ce
renseignements ne sont pas connus de la station ou ont varié, au moyen des
abréviations suivantes :  1° Q. A.B. Je suis en route
pour…………………………........................... ou  Q. T I. Ma route vraie est de.
………………………………………..... degrés ; 2° Q. T H. Ma position est.
………………………….…………………………. ;  3° Q. T. J. Ma vitesse de marche
est………………………….............. km. h.  Si la position est inconnue et ne peut
être déterminée à bord elle sera déterminée aussi vite que possible par le
procédé radio goniométrique ordinaire (Q. T. F. par exemple).  Après accusé de
réception de ce message par la station central de circonscription, l'aéronef
est tenu de faire connaître, et si possible d'avance, tout changement apporté
à son itinéraire et à sa hauteur  L'aéronef donne également connaissance à la
station aéronautique du moment où cesse son vol sans visibilité.  La station
centrale de circonscription porte le mouvement de l'aéronef, d'après ces
messages, sur une carte de contrôle.  Si aucun danger, connu d'elle, de
collision n'existe sur la route parcourue par un aéronef, la station centrale
de circonscription pourra le dispenser de l'envoi des messages ci-dessus, en
lui transmettant l'abréviation :  Q. A. I. Il n'y a pas d'autre aéronef dans
votre voisinage (1).  Au cas où, au cours d'un vol dans les nuages, deux ou
plusieurs aéronefs se rapprocheraient l'un de l'autre, au point de faire
redouter une collision, la station centrale de circonscription avisera les
aéronefs de ce danger de la façon suivante, les abréviations étant utilisées
avec la signification ci-dessous, légèrement différente de leur signification
normale, et se rapportant à la situation de l'aéronef avec lequel une
collision est à craindre pour celui auquel le message est transmis ;  Q. A. K.
Prenez garde à la collision, un (ou plusieurs) aéronef vole dans votre
voisinage……………………………………………………................................  (Indicatif de
l'aéronef avec lequel la collision est à craindre). Q. T. H. La position de
cet aéronef est ................…………………………......  Q. T I. La route vraie de
cet aéronef est. ..........………………………. degrés. ou  Q. A. B. Cet aéronef est en
route pour. …………………………………………..  Q. A. H. Cet aéronef est à une hauteur
de..........………………………….........  Q. T L. La vitesse de marche de cet aéronef
est. …………………..... km.-h.  Les aéronefs conviennent alors entre eux des
hauteurs de vol au-dessus du niveau de la mer ou de préférence de la pression
barométrique à maintenir à leur altimètre pour se croiser sans danger.  La
station centrale de circonscription peut également conseiller une hauteur de
vol en employant l'abréviation Q. F. M. ; volez à.………..…………………… mètres.  Une
station aéronautique peut servir d'intermédiaire et transiter les signaux et
les radiotélégrammes d'aéronef à aéronef, si cela est nécessaire.  Quand un
aéronef fait un vol sans visibilité, la station centrale de circonscription
avec laquelle il est en rapport doit aviser la station centrale de la
circonscription voisine du moment ou il lui semble probable que l'aéronef
entrera dans cette dernière circonscription.  Quand un aéronef quitte un
aérodrome pour un autre aérodrome d'une circonscription voisine, dans lequel
les consignes de mauvaise visibilité sont en vigueur, et que le télégramme
normal de départ, par la voie du service “ trafic ”, risque de n'arriver à la
station centrale de la circonscription de destination qu'après l'entrée de
l'aéronef dans cette circonscription, un message abrégé de départ peut être
envoyé par la station aéronautique de la circonscription de destination et
dans la forme suivante :  Indicatif de la station principale de la
circonscription. Indicatif de l'aéronef.  Abréviation D.E.P., heure de départ.
Indicatif de l'aérodrome de départ.  Quand il sort d'une zone de mauvaise
visibilité, l'aéronef doit prévenir la station centrale de la circonscription
en lui indiquant :  Q. D. T Je vole par visibilité horizontale de plus de
1.000 mètres à la hauteur de.............. mètres au-dessus du niveau de la
mer,  ou  Q. B. G. Je vole au-dessus des nuages à l'altitude de.
.........……………………….. ou  Q. B. H. Je vole au-dessous des nuages à l'altitude
de. ……………………….........  Il est recommandé d'indiquer à quelle altitude se
trouvent les limites supérieures et inférieures des nuages (Q. B. B., Q. B.
J.). Ces renseignements sont alors transmis au poste météorologique local.
III. _Aéronefs militaires_ : En dehors des zones prévues pour l'entraînement
de l'aviation militaire, qui seront choisies, autant que possible, en dehors
des lignes aériennes commerciales, les aéronefs militaires seront, en cas de
mauvaise visibilité, soumis aux mêmes règles que les aéronefs civils.
__________ (1) Q. A. I. peut être suivi de l'abréviation N. I. L. qui ne
change pas sa signification.  Carte des zones d'entraînement de l'aviation
militaire en annexe IV.  **** **Article 3 :** _Entrée et déplacement des
aéronefs civils et militaires dans les zones d'approche_ : Les zones
d'approche sont interdites aux aéronefs autres que ceux qui ont l'intention
d'atterrir sur l'aérodrome ou qui décollent.  _Au départ_ : Les aéronefs non
munis de T. S. F. (ou assimilés), dont l'équipage désire voler vers un
aérodrome sur lequel sont appliquées les consignes de mauvaise visibilité ne
doivent pas prendre le départ.  Sur l'aérodrome lui-même, les vols d'essais et
baptêmes sont suspendus. Les aéronefs non munis de T. S. F., ou assimilés, ne
peuvent prendre le départ.  Les aéronefs munis de T. S. F. ne peuvent partir
qu'après autorisation du directeur de la piste et doivent se mettre en
relation avec la station centrale de circonscription dès leur départ en
indiquant la position, la hauteur, la destination, la route qu'ils vont
suivre, ainsi que la hauteur des limites supérieures et inférieures des nuages
(Q. B. L, Q. B. B.) s'ils le peuvent. Ce dernier renseignement est alors
transmis au poste météorologique local.  _A l'arrivée_ : Les aéronefs non
munis de T S F. (ou assimilés) ne devront pas atterrir sur les aérodromes sur
lesquels les consignes de mauvaise visibilité sont appliquées.  L'équipage est
invité, lorsque les conditions atmosphériques sont suffisamment mauvaises pour
que cela constitue une présomption d'application des consignes de mauvaise
visibilité, à rallier le terrain le plus voisin situé en dehors de la zone
d'approche.  Tout aéronef muni d'appareil de T. S. F et pouvant l'exploiter
conformément aux règlements internationaux doit avertir la station de
l'aérodrome et la station principale de circonscription environ un quart
d'heure avant d'arriver à la limite de la zone d'approche d'un aérodrome sur
lequel sont appliquées les consignes de mauvaise visibilité.  L'abréviation
suivante est utilisée :  Q. A. A. Je compte arriver à......................
(aérodrome) à................. (heure).  L'aéronef indique également s'il vole
au-dessus, au-dessous ou dans les nuages.  Ces signaux sont communiqués par la
station centrale à la station locale et, par celle-ci, au directeur de la
piste.  Au cas où il ne dispose pas des renseignements nécessaires, l'équipage
peut faire prendre ou plusieurs relèvements.  Aucun aéronef muni de T. S. F.
ne peut entrer dans une zone d'approche sans en avoir demandé et obtenu
l'autorisation transmise par la station aéronautique locale. Celle-ci en
réfère au directeur de la piste, qui décide.  L'abréviation suivante est
utilisée : Q. G. L. ? Puis-je entrer dans la zone d'approche ? L'autorisation
est donnée au moyen de l'abréviation : Q. G. L. Vous pouvez entrer dans la
zone d'approche. Et l'interdiction est notifiée au moyen de l'abréviation : Q.
G. M. Il vous est interdit d'entrer dans la zone d'approche.  La station
aéronautique locale avise la station principale de circonscription de l'entrée
de l'aéronef dans sa zone d'approche, si ces deux stations ne sont pas
confondues.  Dans l'étendue d'une zone d'approche, tout aéronef ne communique
qu'avec la station aéronautique locale. Il doit se conformer aux prescriptions
transmises par la station aéronautique locale, en ce qui concerne l'itinéraire
à suivre et la hauteur de vol à observer. Un changement d'itinéraire ou de
hauteur n'est permis que pour des motifs impérieux et la station aéronautique
locale doit en être immédiatement informée.  Lorsqu'un aéronef admis dans la
zone d'approche désire atterrir, il en demande l'autorisation au moyen de
l'abréviation suivante : Q. G. N. ? Puis-je atterrir
à............……………………………………........... ?  L'autorisation est accordée au moyen
de l'abréviation : Q. G. N. Vous pouvez atterrir
à............…………………………………….......  L'interdiction est notifiée au moyen de
l'abréviation : Q. G. O. Il vous est interdit d'atterrir à
……………………………...................  En cas d'interdiction d'atterrir, des ordres
complémentaires peuvent être donnés à l'aéronef en ce qui concerne ses
manœuvres ultérieures (Q. G. Q.). Un seul aéronef est admis dans la zone
d'approche.  Lorsque deux ou plusieurs aéronefs demandent à entrer dans la
zone d'approche, c'est la station aéronautique locale qui leur fait connaître
l'ordre dans lequel auront lieu les atterrissages, par un numéro fixe, sous la
réserve prévue ci-après. Le numérotage se poursuit tant qu'il se présente est
reste un aéronef en l'air.  L'abréviation suivante est utilisée :  Q. G. P.
Votre tour d'atterrissage est ..…………………………………............  L'invitation à
atterrir sera transmise à un aéronef de la façon suivante :  Indicatif de
l'aéronef suivi de l'abréviation : Q. G. N.  L'ordre d'atterrissage, comme
d'ailleurs tous les ordres relatifs à la navigation, dans la zone d'approche,
sont donnés par le directeur de la piste. Celui-ci se rend, si possible, dans
ce but, au radiogoniomètre.  S'il ne s'y rend pas, la station lui communique
tous les renseignements reçus des avions, relatifs à la navigation dans la
zone d'approche et transmet les ordres du directeur de la piste aux aéronefs
situés dans cette zone. Les communications sont échangées par Télétype ou, à
défaut, par téléphone  Si le directeur de la piste se trouve à la station
aéronautique, seuls les relèvements, caps et ordres d'exploitation
radioélectriques sont transmis sur l'initiative du personnel radioélectricien,
tous les autres signaux relatifs à la navigation dans la zone d'approche et à
l'atterrissage sont transmis sur l'ordre du directeur de la piste.  Si le
directeur de la piste est présent à l'aérodrome et relié par Télétype ou
téléphone à la station aéronautique, les relèvements, caps, ordres
d'exploitation radioélectriques. signaux M. N., M. E., M. S., M. W., Z. Z. Z.,
Z. Y. Z., J. Z. J., J. Y. J. (anciens Z. Z., Y. Y., J. J.) sont transmis aux
aéronefs sur l'initiative du personnel radioélectricien, les autres signaux
relatifs à la navigation dans la zone d'approche et à l'atterrissage sont
transmis sur l'ordre du directeur de la piste, donné sous forme de télégramme.
Enfin, si le directeur de la piste ne répond pas aux appels téléphoniques ou
télégraphiques, le chef de station radioélectrique ou même l'opérateur
radioélectricien de service, le cas échéant, se substitue à lui.  Lorsque
l'aéronef qui a reçu le n° 1 d'ordre d'atterrissage est autorisé à atterrir,
il doit immédiatement descendre au-dessous de 400 mètres (au-dessus du sol) ;
le n° 2 doit alors voler à 700 mètres, le n° 3 à 1.000 mètres. Lorsque le n° 2
est autorisé à atterrir, il doit immédiatement descendre au-dessous de 400
mètres, le n° 3 doit alors voler à 700 mètres, le n° 4 à 1.000 mètres. Lorsque
le n° 3est autorisé à atterrir, il doit immédiatement descendre au-dessous de
400 mètres, etc.  En général, l'ordre suivant sera respecté :  a) Aéronef,
sans distinction, obligé d'atterrir par suite de panne de moteur, autres
avaries empêchant l'aéronef de manœuvrer manque de carburant ;  b) Aéronefs
spéciaux, tels qu'aéronefs sanitaires ayant un malade à bord ;  c) Aéronefs de
transports publics ; d) Aéronefs militaires ;  e) Aéronefs privés.  L'ordre
fixé peut être modifié dans certaines circonstances.  En particulier, après
deux tentatives infructueuses d'atterrissage, le numéro d'un aéronef peut être
changé.  Les aéronefs qui doivent différer leur atterrissage reçoivent de la
station aéronautique un des ordres suivants :  Q. B. G. Volez au-dessus de la
couche des nuages à l'altitude de ….....  Q. G. G. Attendez des ordres et
restez à la hauteur de mètres aux environs de….... ou : Q. G. K. Volez de
manière que votre relèvement vrai, par rapport à .................... reste
constant à ....................degrés et à une hauteur de
..................... mètres.  Pendant l'application des consignes de brume,
des textes contenant les réponses à faire en ce qui concerne la météorologie,
aux aéronefs qui désirent atterrir sur les aérodromes voisins, sont fournis si
possible par la station ou le poste météorologique à la station
radioélectrique aéronautique, à la station du réseau radioélectrique de
l'année de l'air s'il en existe une sur l'aérodrome intéressé et au directeur
de la piste. Ils sont renouvelés aussi souvent que l'évolution du temps
l'exige. La station aéronautique et la station radioélectrique de l'armée de
l'air peuvent ainsi renseigner les aéronefs sur les possibilités
d'atterrissage sur un terrain voisin, en transmettant intégralement une ou
plusieurs fractions de textes remis.  Les aéronefs ayant pénétré sans avis
préalable dans la zone d'approche peuvent être invités par la station
aéronautique à s'en éloigner. L'abréviation suivante sera utilisée :  Q. G. M.
Sortez de la zone d'approche.  A tout aéronef admis dans la zone d'approche la
correction barométrique du moment et les caractéristiques du vent au sol à
l'aérodrome sont transmises par les abréviations suivantes :  Q. F. E. La
pression barométrique actuelle, non réduite au niveau de la mer, au sol de
l'aérodrome de.................... (nom de l'aérodrome) est de.
................... (mb ou mm).  Q. A. N. Voici le dernier message
météorologique du vent au sol pour. ................... (lieu de
l'observation).  Sur tout aérodrome important, autour duquel une zone
d'approche est instituée, par mauvaise visibilité, on s'efforcera d'établir un
service radioélectrique spécial, utilisant, tant à l'émission qu'à la
réception, les fréquences prévues par le B. S. I. T. A. pour les manœuvres
d'atterrissage par mauvaise visibilité et distinct du service de la station
aéronautique.  Tout aéronef admis à pénétrer dans la zone d'approche d'un
aérodrome où fonctionne un service spécial pour les manœuvres d'atterrissage
par mauvaise visibilité, sera invité à changer d'onde de veille et d'émission.
Les abréviations suivantes seront utilisées : Par exemple :  Q. S. W : Q. S. Y
: Je vais transmettre sur. ......... kc/s. (.............. m) : passez à la
transmission sur.............. kc/s. (................ m).  **Annexe I**
**Liste des aérodromes où sont appliquées les consignes de mauvaise
visibilité.** Les listes des aérodromes où seront appliquées les consignes de
mauvaise visibilité seront publiées par avis aux navigateurs aériens et dans
le règlement du service international des télécommunications de
l'aéronautique.  **Annexe II** **Consignes particulières à chaque aérodrome.**
Ces consignes seront également publiées dans les mêmes formes et en même temps
que les listes des aérodromes visés à l'annexe I ci-dessus.  **Annexe III**
Sur les aérodromes mixtes occupés à la fois par les civils et les militaires,
il existe un directeur de la piste. Ce dernier est responsable de la
signalisation, de la circulation aérienne et de la discipline des vols.  Sur
les aérodromes entièrement civils, le commandant d'aérodrome civil exerce les
fonctions de directeur de la piste.  Sur les aérodromes entièrement
militaires, le commandant de la base aérienne exerce les fonctions de
directeur de la piste.  **Annexe IV** La carte des zones de pilotage sans
visibilité de l'armée de l'air (paragraphe III de l'instruction), sera publiée
par avis aux navigateurs aériens.  ****

 ### Source: URL: https://juridiahackhaton.blob.core.windows.net/fine-tuning/documents/13440.html type: Arrêté date_publication: 1939-05-04 title: Arrêté viziriel du 14 rebia I 1358 (4 mai 1939) relatif au vol des aéronefs par mauvaise visibilité."
