Question,Answer,Context
ما هي الحالات العصبية التي قد تؤدي إلى رفض طلب الحصول على رخصة القيادة أو تجديدها؟,"بناءً على النص المقدم، إليك الحالات العصبية التي قد تؤدي إلى رفض طلب الحصول على رخصة القيادة أو تجديدها:

**الحالات العصبية التي تمنع الحصول على رخصة القيادة أو تجديدها (بشكل عام):**

*   **التهاب الدماغ:** أي التهاب يصيب الدماغ.
*   **التصلب المتعدد:** مرض يؤثر على الجهاز العصبي المركزي.
*   **الوهن العضلي الوبيل:** مرض يسبب ضعف العضلات.
*   **الأمراض الوراثية للجهاز العصبي:** الأمراض التي تنتقل وراثياً وتؤثر على الجهاز العصبي، خاصة تلك المرتبطة بضمور العضلات التدريجي واضطرابات التوتر العضلي الخلقية.
*   **أمراض الجهاز العصبي المحيطي:** أي أمراض تصيب الأعصاب خارج الدماغ والحبل الشوكي.
*   **إصابات الجهاز العصبي:** سواء كانت مركزية (الدماغ والحبل الشوكي) أو محيطية، ما لم يكن هناك رأي طبي يسمح بالقيادة مع مراعاة شروط السلامة. يجب إعادة فحص هذه الحالات بشكل دوري.

**بالإضافة إلى ذلك، هناك حالات أخرى تتعلق بالجهاز العصبي وتؤثر على أهلية القيادة:**

*   **الصرع:** بشكل عام، لا يتم منح رخصة القيادة أو تجديدها للمصابين بالصرع. ومع ذلك، قد تسمح بعض التشريعات الوطنية بمنح الرخصة لمن لم يتعرض لنوبات صرع لفترة طويلة (مثل سنتين)، وذلك بعد الحصول على رأي طبي معتمد.
*   **الأمراض الدماغية الوعائية:** لا يتم منح الرخصة أو تجديدها إلا بعد الحصول على رأي طبي معتمد، وقد يتطلب الأمر تعديلات في السيارة أو استخدام سيارة خاصة. يجب أن تكون مدة صلاحية الرخصة محدودة وفقًا للرأي الطبي.
*   **إصابات الحبل الشوكي:** التي تؤدي إلى الشلل النصفي، ما لم تكن السيارة مجهزة بأدوات تحكم خاصة.

**ملاحظات هامة:**

*   **الرأي الطبي المعتمد:** في العديد من الحالات المذكورة، يمكن منح الرخصة أو تجديدها إذا كان هناك رأي طبي معتمد يسمح بذلك، مع الأخذ في الاعتبار شروط السلامة والتعديلات اللازمة في السيارة.
*   **الفحص الدوري:** يجب إعادة فحص بعض الحالات بشكل دوري للتأكد من استمرار الأهلية للقيادة.
*   **القيادة الآمنة:** الهدف الأساسي من هذه القيود هو ضمان سلامة السائقين ومستخدمي الطريق الآخرين.

**ملخص:**

بشكل عام، أي حالة عصبية تؤثر على القدرة على التحكم في السيارة بشكل آمن، أو تسبب نوبات مفاجئة أو فقدان للوعي، قد تؤدي إلى رفض طلب الحصول على رخصة القيادة أو تجديدها. يجب دائمًا استشارة الطبيب المختص لتقييم الحالة وتحديد مدى الأهلية للقيادة.
","### Context: ---  
**Bulletin Officiel n° 3946 du 30 chaoual 1408 (15 juin 1988)**  
**EDITION DE TRADUCTION OFFICIELLE**  
****  
**Dahir n° 1-83-271 du 11 rebia I 1407 (14 novembre 1986) portant publication
de l'accord sur les exigences minimales pour la délivrance et la validité des
permis de conduire (APC), fait à Genève le 1er avril 1975.** **LOUANGE A DIEU
SEUL !** _Grand Sceau de Sa Majesté Hassan II :_ Que l'on sache par les
présentes - puisse Dieu en élever et en fortifier la teneur ! Que Notre
Majesté Chérifienne, Vu l'accord sur les exigences minimales pour la
délivrance et la validité des permis de conduire (APC), fait à Genève le 1er
avril 1975 ; Vu le procès-verbal de dépôt des instruments d'adhésion du
Royaume du Maroc, fait à New-York le 31 mars 1983, **A décidé ce qui suit :**
**Article Premier :** Sera publié au “ Bulletin officiel ”, tel qu'il est
annexé au présent dahir, l'accord sur les exigences minimales pour la
délivrance et la validité des permis de conduire (APC), fait à Genève le 1er
avril 1975. **Article 2 :** Le présent dahir sera publié au _Bulletin
officiel._ __ _Fait à Rabat, le 11 rebia l 1407 (14 novembre 1986)._ __ Pour
contreseing :  
_Le Ministre des finances,  
_**Dr Azzeddine Laraki.** ***** *** *** **Accord sur les exigences minimales
pour la délivrance et la validité des permis de conduire (APC)** Les parties
contractantes, Désireuses de réaliser une plus grande uniformité des règles
concernant la délivrance et la validité des permis de conduire, en vue
d'améliorer la sécurité de la circulation routière et de faciliter la
délivrance de tels permis aux conducteurs étrangers acquérant une résidence
normale sur leur territoire ; Tenant compte des dispositions du paragraphe 3
de l'article 8 et du paragraphe 3 de l'article 41 de la convention sur la
circulation routière ouverte à la signature à Vienne le 8 novembre 1968, Sont
convenues de ce qui suit : **Article premier :** Domaine d'application et
définitions 1\. Le présent accord s'applique aux permis de conduire, à
l'exclusion des permis de conduire d'élèves-conducteurs, des permis de
conduire pour la conduite des cyclomoteurs et des permis de conduire pour la
conduite des automobiles dont le conducteur se déplace à pied, valables pour
les catégories de véhicules définies dans les annexes 6 et 7 de la convention
sur la circulation routière ouverte à la signature à Vienne le 8 novembre
1968. Il ne s'applique pas aux permis de conduire délivrés avant son entrée en
vigueur ni à leur renouvellement, sauf si la validité desdits permis a été
prorogée après cet date à de nouvelles catégories de véhicules. 2\. Sauf
mention contraire, les termes utilisés dans le texte du présent accord ont la
signification qui leur est attribuée dans la convention visée au paragraphe 1
du présent article. 3\. Aux fins du présent accord, on entend par “ groupe de
véhicules ” une subdivision d'une des catégories visées au paragraphe 1 du
présent article. **Article 2 :** Examen de conduite 1\. Les permis nationaux
de conduire ne seront délivrés qu'à des conducteurs ayant subi avec succès un
examen approprié à la conduite des véhicules de la catégorie ou des catégories
pour lesquelles le permis sera valable. 2\. Les dispositions nationales
relatives à cet examen ne seront pas moins strictes quant au fond que celles
qui sont énoncées dans l'annexe I du présent accord. 3\. Les dispositions du
présent article ne sont pas applicables au renouvellement d'un permis ainsi
obtenu. **Article 3 :** Aptitude physique et mentale requise des conducteurs
Les dispositions nationales relatives à l'aptitude physique et mentale requise
pour obtenir un permis de conduire national et pour continuer à en être
titulaire ne seront pas moins strictes quant au fond que celles qui sont
énoncées dans l'annexe II du présent accord. **Article 4 :** Délivrance d'un
permis de conduire par une partie contractante sur la base d'un permis délivré
par une autre partie contractante __ 1\. Nonobstant les dispositions du
paragraphe 1 de l'article 2 du présent accord, un permis de conduire national
sera délivré, sur demande, par une partie contractante ou une de ses
subdivisions, au titulaire d'un permis de conduire national valable, délivré
conformément aux dispositions du paragraphe 2 de l'article 2 et de l'article 3
du présent accord, sur le territoire d'une autre partie contractante, après
l'entrée en vigueur du présent accord entre les deux parties contractantes en
question, sans que le conducteur concerné ait à subir un examen de conduite ou
un examen médical, à condition que : a) ledit conducteur ait acquis une
résidence normale sur le territoire de la partie contractante qui délivre le
nouveau permis ; b) l'âge dudit conducteur ne soit pas inférieur à l'âge
requis sur le territoire de la partie contractante qui délivre le nouveau
permis ; c) le permis de conduire étranger soit remis aux autorités
compétentes de la partie contractante qui délivre le nouveau permis. 2\. Les
dispositions du paragraphe 1 du présent article ne font pas obstacle à ce que
toute partie contractante applique à la délivrance du nouveau permis de
conduire les dispositions de sa législation nationale relatives à cette
délivrance et concernant des questions autres que celles couvertes par le
présent accord. 3\. Le permis de conduire ainsi délivré sera valable pour la
conduite des véhicules pour lesquels le permis remis était valable, et sa
validité sera soumise aux conditions figurant sur ce dernier. 4\. - Le permis
remis pourra être renvoyé aux autorités qui l'ont délivré. **Article 5 :**
Signature et adhésion au présent accord 1\. Le présent accord est couvert à la
signature ou à l'adhésion des Etats membres de la Commission économique pour
l'Europe des Nations Unies et des Etats admis à la commission à titre
consultatif conformément au paragraphe 8 du mandat de cette commission, qui
ont ratifié la convention sur la circulation routière et la convention sur la
signalisation routière, ouvertes toutes deux à la signature à Vienne le 8
novembre 1968, ou qui ont adhéré à ces deux conventions. 2\. Les Etats
susceptibles de participer à certains travaux de la Commission économique pour
l'Europe en application du paragraphe 11 du mandat de cette commission, et qui
ont ratifié la convention sur la circulation routière et la convention sur la
signalisation routière, ouvertes toutes deux à la signature à Vienne le 8
novembre 1968, ou qui ont adhéré à ces deux conventions, peuvent devenir
parties contractantes au présent accord en y adhérant après son entrée en
vigueur. 3\. Le présent accord sera ouvert à la signature jusqu'au 1er avril
1976 inclus. Après cette date, il sera ouvert à l'adhésion. 4\. Le présent
accord sera soumis à la ratification des Etats signataires. 5\. Les
instruments de ratifications ou d'adhésion seront déposés auprès du secrétaire
général de l'Organisation des nations Unies. **Article 6 :** Application du
présent accord par une partie contractante aux territoire dont elle assure les
relations internationales 1\. Tout Etat pourra, au moment où il signera ou
ratifiera le présent accord ou y adhérera ou à tout moment ultérieur,
déclarer, par notification adressée au secrétaire général que l'accord devient
internationale ou à l'un quelconque d'entre eux. Le présent accord deviendra
applicable au territoire ou aux territoire désigné (s) dans la notification
trente jours après la date à laquelle le secrétaire général aura reçu cette
notification ou à la date d'entrée en vigueur de l'accord pour l'Etat
adressant la notification, si cette date est postérieure à la précédente. 2\.
Tout Etat qui aura fait une déclaration en vertu du paragraphe 1 du présent
article pourra à toute date ultérieure, par notification adressée au
secrétaire général, déclarer que l'accord cessera d'être applicable au
territoire désigné dans la notification et l'accord cessera d'être applicable
audit territoire un an après la date de réception de cette notification par le
secrétaire général. **Article 7 :** Entrée en vigueur du présent accord 1\. Le
présent accord entrera en vigueur le quatre-vingt-dixième jour après que cinq
des Etats mentionnés au paragraphe 1 de son article 5 auront déposé leur
instrument de ratification ou d'adhésion. 2\. Pour chaque Etat qui ratifiera
le présent accord ou y adhérera après que cinq Etats auront déposé leur
instrument de ratification ou d'adhésion, l'accord entrera en vigueur le
quatre-vingt-dixième jour qui suivra la date du dépôt, par cet Etat, de son
instrument de ratification ou d'adhésion. **Article 8 :** Procédure
d'amendement au texte principal et aux annexes du présent accord 1\. Après une
période de douze mois à dater de l'entrée en vigueur du présent accord, toute
partie contractante pourra proposer un ou plusieurs amendements à l'accord. Le
texte de toute proposition d'amendement, accompagné d'un exposé des motifs,
sera adressé au secrétaire général qui le communiquera à toutes les parties
contractantes. Les parties contractantes auront la possibilité de lui faire
savoir dans le délai de six mois suivant la date de cette communication : a)
si elles acceptent l'amendement, ou b) si elles le rejettent, ou c) si elles
désirent qu'une conférence soit convoquée pour l'examiner. Le secrétaire
général transmettra également le texte de l'amendement proposé aux autres
Etats visés à l'article 5 du présent accord. 2\. a) Toute proposition
d'amendement qui aura été communiquée conformément aux dispositions du
paragraphe 1 du présent article sera réputée acceptée si, dans le délai de six
mois susmentionné, moins du tiers des parties contractantes informant le
secrétaire général soit qu'elles rejettent l'amendement, soit qu'elles
désirent qu'une conférence soit convoquée pour l'examiner. Le secrétaire
général notifiera à toutes les parties contractantes toute acceptation ou tout
rejet de l'amendement proposé et toute demande de convocation d'une
conférence. Si le nombre total des rejets et des demandes reçus pendant le
délai spécifié de six mois est inférieur au tiers du nombre total des parties
contractantes, le secrétaire général notifiera à toutes les parties
contractantes que l'amendement entrera en vigueur six mois après l'expiration
du délai de six mois spécifié au paragraphe 1 du présent article pour toutes
les parties contractantes, à l'exception de celles qui, pendant le délai
spécifié, ont rejeté l'amendement ou demandé la convocation d'une conférence
pour l'examiner. b) Toute partie contractante qui, pendant ledit délai de six
mois, aura rejeté une proposition d'amendement ou demandé la convocation d'une
conférence pour l'examiner, pourra, à tout moment après l'expiration de ce
délai, notifier au secrétaire général qu'elle accepte l'amendement, et le
secrétaire général communiquera cette notification à toutes les autres parties
contractantes. L'amendement entrera en vigueur, pour la partie contractante
qui aura notifié son acceptation, six mois après la date à laquelle le
secrétaire général aura reçu la notification. 3\. Si un amendement proposé n'a
pas été accepté conformément au paragraphe 2 du présent article et si, dans le
délai de six mois spécifié au paragraphe 1 du présent article, moins de la
moitié du nombre total des parties contractantes informent le secrétaire
général qu'elles rejettent l'amendement proposé et si un tiers au moins du
nombre total des parties contractantes, mais pas moins de cinq, l'informent
qu'elle acceptent ou qu'elles désirent qu'une conférence soit réunie pour
l'examiner, le secrétaire général convoquera une conférence en vue d'examiner
l'amendement proposé ou toute autre proposition dont il serait saisi en vertu
du paragraphe 4 du présent article. 4\. Si une conférence est convoquée
conformément aux dispositions du paragraphe 3 du présent article, le
secrétaire général y invitera toutes les parties contractantes et les autres
Etats visés à l'article 5 du présent accord. Il demandera à tous les Etats
invités à la conférence de lui présenter, au plus tard six mois avant sa date
d'ouverture, toutes propositions qu'ils souhaiteraient voir examiner également
par ladite conférence en plus de l'amendement proposé, et il communiquera ces
propositions, trois mois au moins avant la date d'ouverture de la conférence,
à tous les Etats invités à la conférence. 5\. a) Tout amendement au présent
accord sera réputé accepté s'il a été adopté à la majorité des deux tiers des
Etats représentés à la conférence, à condition que cette majorité groupe au
moins les deux tiers des parties contractantes représentées à la conférence.
Le secrétaire général notifiera à toutes les parties contractantes
l'amendement et celui-ci entrera en vigueur six mois après la date de cette
notification pour toutes les parties contractantes, à l'exception de celles
qui, durant ce délai, auront notifié au secrétaire général qu'elles rejettent
l'amendement. b) Toute partie contractante qui aura rejeté un amendement
pendant ledit délai de six mois pourra, à tout moment, notifier au secrétaire
général qu'elle l'accepte, et le secrétaire général communiquera cette
notification à toutes les autres parties contractantes. L'amendement entrera
en vigueur pour la partie contractante qui aura notifié son acceptation, six
mois après la date à laquelle le secrétaire général aura reçu la notification.
6\. Si la proposition d'amendement n'est pas réputée acceptée conformément au
paragraphe 2 du présent article, et si les conditions prescrites au paragraphe
3 du présent article pour la convocation d'une conférence ne sont pas réunies,
la proposition d'amendement sera réputée rejetée. 7\. Indépendamment de la
procédure d'amendement prévue aux paragraphes 1 à 6 du présent article, les
annexes au présent accord peuvent être modifiées par accord entre les
administrations compétentes de toutes les parties contractantes. Si
l'administration d'une partie contractante a déclaré que son droit national
l'oblige à subordonner son accord à l'obtention d'une autorisation spéciale à
cet effet ou à l'approbation d'un organe législatif, le consentement de
l'administration compétente de la partie contractante en cause à la
modification des annexes ne sera considéré comme donné qu'au moment où cette
administration aura déclaré au secrétaire général que les autorisations ou les
approbations requises ont été obtenues. L'accord entre une période
transitoire, les anciennes dispositions des annexes resteront en vigueur, en
tout ou en partie, simultanément avec les nouvelles. Le secrétaire général
fixera la date d'entrée en vigueur des nouvelles dispositions. 8\. Chaque
Etat, au moment où il signera ou ratifiera le présent accord, ou y adhérera,
notifiera au secrétaire général les nom et adresse de son administration
compétente pour donner l'accord prévu au paragraphe 7 du présent article.
**Article 9 :** Dénonciation du présent accord Toute partie contractante
pourra dénoncer le présent accord par notification écrite adressée au
secrétaire général. La dénonciation prendra effet un an après la date à
laquelle le secrétaire général en aura reçu notification. **Article 10 :**
Abrogation du présent accord Le présent accord cessera d'être en vigueur si le
nombre des parties contractantes est inférieur à cinq pendant une période
quelconque de douze mois consécutifs. **Article 11 :** Règlement de différends
1.Tout différend entre deux ou plusieurs parties contractantes touchant
l'interprétation ou l'application du présent accord que les parties en litige
n'auraient pu régler par voie de négociation ou d'autre manière, sera soumis à
l'arbitrage si l'une quelconque des parties contractantes en litige le demande
et sera, en conséquence, renvoyé à un ou plusieurs arbitres choisis d'un
commun accord par les parties en litige. Si, dans les trois mois à dater de la
demande d'arbitrage, les parties en litige n'arrivent pas à s'entendre sur le
choix d'un arbitre ou des arbitres, l'une quelconque de ces parties pourra
demander au secrétaire général de l'Organisation des Nations Unies de désigner
un arbitre unique devant lequel le différend sera renvoyé pour décision. 2\.
La sentence de l'arbitre ou des arbitres désignés conformément au paragraphe 1
du présent article sera obligatoire pour les parties contractantes en litige.
**Article 12 :** Déclarations relatives à l'application de certaines
dispositions du présent accord 1\. Tout Etat pourra, au moment où il signera
le présent accord ou déposera son instrument de ratification ou d'adhésion,
formuler des réserves portant sur les points suivants : a) déclarer qu'il ne
se considère pas lié par l'article 11 du présent accord. Les autres parties
contractantes ne seront pas liées par l'article 11 vis-à-vis de l'une
quelconque des parties contractantes qui aura fait une telle déclaration ; b)
déclarer qu'il ne se considère pas lié par l'article 4 du présent accord pour
autant qu'il s'agisse de permis pour la conduite d'un ou de plusieurs groupes
donnés de véhicules. Les autres parties contractantes ne seront pas liées par
l'article 4 du présent accord pour autant qu'il s'agisse de permis pour le ou
les groupes de véhicules en question vis-à-vis de l'une quelconque des parties
contractantes qui aura fait une telle déclaration ; c) déclarer que,
nonobstant les dispositions du paragraphe 3 de l'article 4 du présent accord,
la validité d'un permis de conduire délivré en vertu du paragraphe 1 dudit
article au titulaire d'un permis de conduire national valable portant
l'inscription visée au paragraphe 12 de l'annexe I de l'accord sera
exclusivement limitée à la conduite des véhicules équipés d'une transmission
automatique. 2\. Aucune réserve autre que celles prévues au paragraphe 1 du
présent article ne sera admise. 3\. Tout Etat qui aura formulé une réserve en
vertu du présent article pourra la retirer à tout moment par notification
adressée au secrétaire général. 4\. Le secrétaire général communiquera les
réserves et notifications faites en application du présent article à tous les
Etats visés à l'article 5 du présent accord. **Article 13 :** Notifications
aux parties contractantes Outre les déclarations, notification et
communications prévues aux articles 8 et 12 du présent accord, le secrétaire
général notifiera aux parties contractantes et aux autres Etats visés à
l'article 5 : a) les signatures, ratifications et adhésions au titre de
l'article 5 ; b) les notifications et déclarations au titre de l'article 6 ;
c) les dates auxquelles le présent accord entrera en vigueur conformément à
l'article 7 ; d) la date d'entrée en vigueur des amendements au présent accord
conformément aux paragraphes 2, 5 et 7 de l'article 3 ; e) les dénonciations
au titre de l'article 9 ; f) l'abrogation du présent accord au titre de
l'article 10 ;  g) les réserves au titre de l'article 12. **** **Article 14
:** Dépôt du texte du présent accord auprès du secrétaire général Après le 1er
avril 1976, l'original du présent accord sera déposé auprès du secrétaire
général de l'Organisation des Nations Unies, qui en transmettra des copies
certifiées conformes à tous les Etats visés à l'article 5 du présent accord.
En foi de quoi, les soussignés, à ce dûment autorisés, ont signé le présent
accord. Fait à Genève, le premier avril mil neuf cent soixante quinze, en un
seul exemplaire, en langues anglaise, française et russe, les trois textes
faisant également foi. ***** *** *** **Annexe I** Exigences minimales pour les
examens de conduite _L'examinateur_ Conditions exigées 1\. Instruction
générale : Les candidats devront être titulaires d'un certificat d'études
secondaires (4 ans d'études au moins après le primaire) ou d'un diplôme de
niveau équivalent, à moins qu'ils ne suivent un cours prolongé de formation
spéciale. 2\. Permis de conduire et expérience de la conduite : Les candidats
devront détenir un permis valable de la catégorie pour laquelle ils seront
autorisés à faire passer les examens, sauf dans le cas de la catégorie D, pour
laquelle un permis de la catégorie C pour être considéré comme suffisant. Ils
devront avoir une expérience de la conduite d'au moins trois ans. Durant les
trois années précédant le moment où ils ont posé leur candidature, ils ne
devront pas avoir été déchus du droit de conduire ni avoir été reconnus
coupables, après jugement, d'une violation du Code de la route constituant un
grave danger pour la sécurité routière. 3\. Age minimum : L'âge du candidat
sera d'au moins 23 ans. 4\. Aptitude : Les dispositions nationales établiront
des normes d'aptitude physique et mentale non moins strictes quant au fond que
celles qui sont énoncées à l'annexe II du présent accord pour la délivrance et
le renouvellement des permis des catégories A et B. Les candidats devront en
outre avoir les qualités psychologiques et morales requises. 5\. Formation :
Les candidats devront avoir suivi avec succès un cours de formation spéciale,
théorique et pratique, sur tous les aspects de la profession d'examinateur, et
notamment sur le niveau d'habilité à la conduite requis d'un examinateur.
Déchéances 6\. Si la validité du permis de conduire d'un examinateur est
suspendue, celui-ci ne remplira pas les fonctions d'examinateur pendant la
période d'invalidité de son permis. Cependant, si le permis a été suspendu
uniquement pour des raisons d'incapacité physique, l'examinateur peut
continuer à faire subir des examens théoriques. 7\. Si un examinateur a été
reconnu coupables après jugement, d'une violation du Code de la route
constituant un grave danger pour la sécurité routière, les autorités
compétentes détermineront s'il demeure apte à exercer le métier d'examinateur.
Surveillance 8\. On surveillera les examinateurs au cours de leur travail afin
de s'assurer qu'ils appliquent les normes appropriées. __ L'examen théorique
Forme 9\. La forme sera choisie de façon à permettre de s'assurer que le
candidat a les connaissances raisonnées requises au sujet des questions
énumérées dans les paragraphes 10. et 11. de la présente annexe. Contenu 10\.
Connaissance raisonnée de la réglementation et, plus particulièrement, des
règlements applicables à l'utilisation des véhicules de la catégorie
correspondant au type de permis demandé : 10.1. connaissance raisonnée des
règles de la circulation routière, de la signalisation et des marques
routières, et de leur signification ; 10.2. connaissance élémentaire raisonnée
des règlements techniques concernant la sécurité des véhicules en circulation
; 10.3. connaissance raisonnée des règles s'appliquant au conducteur, dans la
mesure où elles concernent la sécurité routière, y compris, pour les
conducteurs de véhicules des catégories C et D seulement, des règles relatives
aux heures de travail et aux périodes de repos ; 10.4. connaissance raisonnée
des règles spécifiant la façon dont le conducteur doit se comporter en cas
d'accident. 11\. Connaissance raisonnée dans d'autres domaines : 11.1.
connaissance raisonnée suffisante de l'importance des questions de sécurité
routière et particulièrement des factures d'accident suivants : 11.1.1.
dangers de la circulation tels que le danger des manoeuvres de dépassement,
l'estimation erronée de la vitesse (effets sur les distances de freinage et de
sécurité), l'influence des conditions atmosphériques (neige, pluie,
brouillard, vent latéral, hydroplanage), le comportement des autres usagers de
la route, et en particulier des personnes âgées et des enfants ; 11.1.2.
factures susceptibles d'amoindrir la vigilance et l'aptitude physique et
mentale du conducteur, tels que fatigue, maladie, alcool et autres drogues,
etc. ; 11.1.3. facteurs de sécurité concernant le chargement du véhicule et
les personnes transportées ; 11.2. véhicules de catégories A et B seulement :
connaissance de base des éléments du véhicule essentiels pour la protection de
ses occupants et pour la sécurité routière, tels que freins, pneumatiques,
niveaux d'huile, ceintures de sécurité, etc ; véhicules des catégories C.D et
E seulement : connaissance du fonctionnement et de l'entretien simple des
éléments précités et de tous les autres dispositifs et parties présentant un
intérêt particulier pour la sécurité ; 11.3. connaissance des mesures à
prendre, le cas échéant, pour venir en aide aux victimes d'accidents de la
route. L'examen pratique Le véhicule et son équipement 12\. - Si le candidat
passe l'examen sur un véhicule équipé d'un changement de vitesse automatique,
ceci sera indiqué sur tout permis délivré sur la base d'un tel examen ; \-
Véhicules de la catégorie C : le poids maximal autorisé ne sera pas inférieur
à 7.000 kg ; \- Véhicules de la catégorie D : le nombre de sièges ne sera pas
inférieur à 28 et la longueur du véhicule ne sera pas inférieure à 7 m ; \-
Véhicules de la catégorie E : lorsque le véhicule tracteur est de la catégorie
C et s'il ne s'agit pas d'une semi-remorque, la remorque aura au moins deux
essieux dont l'écartement sera supérieur à un mètre. Contenu 13 Maniement du
véhicule ; Les principales manoeuvres que le candidat devra exécuter pour
prouver qu'il est maître de son véhicule sont les suivantes : 13.1. démarrage
en côte ; 13.2. véhicules des catégories B, C, D et E seulement : marche
arrière et virage en marche arrière ; 13.3. freinages et arrêts à différentes
vitesses, y compris arrêts d'urgence, si les conditions de la route et de la
circulation le permettent ; 13.4. véhicules des catégories B, C, D et E
seulement : stationnement en oblique, stationnement sur une pente, montante ou
descendante ; 13.5. demi-tour sur un espace limité ; 13.6. véhicules de la
catégorie A seulement : marche à faible allure. 14 Comportement en circulation
: On s'assurera principalement que le candidat : 14.1. maintient son véhicule
sur la partie de la chaussée où il doit être ; 14.2. prend correctement les
virages à droite et à gauche ; 14.3. exécute correctement les manoeuvres de
changement de voie et de changement de direction aux intersections ; 14.4. est
attentif à la circulation ; 14.5. se comporte correctement aux intersections,
en tenant dûment compte de tous les mouvements des autres usagers de la route,
et plus spécialement des priorités ; 14.6. adapte sa vitesse aux circonstances
; 14.7. utilise les miroirs rétroviseurs ; 14.8. signale correctement les
manoeuvres qu'il compte faire ; 14.9. sait faire fonctionner correctement les
dispositifs d'éclairage du véhicule, ses dispositifs avertisseurs et ses
autres dispositifs auxiliaires ; 14.10 conduit avec la prudence voulue et avec
les égards voulus vis-à-vis des piétons et des autres usagers de la route ;
14.11. se comporte comme il convient vis-à-vis des véhicules de transport
publics ; 14.12. respecte les signaux lumineux de circulation et les
injections des agents autorisés réglant la circulation ; 14.13. réagit de
façon appropriées aux signaux prévus par la réglementation que font les autres
usagers de la route ; 14.14. respecte la signalisation routière, les marques
routières et les passages pour piétons ; 14.15. maintient une distance
suffisante entre son véhicule et celui qui le précède ou entre son véhicule et
les véhicules circulant parallèlement ; 14.16. exécute correctement les
manoeuvres de dépassement ; 14.17. utilise correctement la ceinture de
sécurité lorsque le véhicule doit en être équipé. Ordre dans lequel les
parties de l'examen devraient se dérouler 15\. Autant que possible, la partie
de l'examen décrite au paragraphe 13. devrait avoir lieu avant celle décrite
au paragraphe 14. 16\. La durée de l'examen et la distance à parcourir doivent
être suffisantes pour les vérifications prescrites au paragraphes 13 et 14. La
durée de la partie de l'examen décrite au paragraphe 14 devrait dépasser 30
minutes, mais ne sera en aucun cas inférieure à 20 minutes. Lieu de l'examen
17\. La partie de l'examen décrite dans le paragraphe 13 pourra se dérouler
sur un terrain d'épreuve spécial ; dans ce cas, des critères précis devraient
être établis pour mesurer objectivement l'aptitude du candidat à manoeuvrer le
véhicule. La partie de l'examen prévue au paragraphe 14 aura lieu, si
possible, sur des routes situées en dehors des agglomérations et sur des
autoroutes, ainsi que dans la circulation urbaine. **Annexe II** Normes
minimales concernant l'aptitude physique et mentale Définitions 1\. Aux fins
de la présente annexe, les conducteurs sont classés en deux groupes : 1.1.
Groupe 1 : conducteurs de véhicules des catégories A et B. 1.2. Groupe 2 :
conducteurs de véhicules des catégories C, D et E. 2\. Par analogie, les
candidats à la délivrance ou au renouvellement d'un permis de conduite sont
classés dans le groupe auquel ils appartiendront une fois le permis délivré ou
renouvelé. Examens médicaux 3\. Groupe 1 : les candidats doivent faire l'objet
d'un examen médical s'il apparaît, lors de l'accomplissement des formalités
requises, ou au cours des épreuves qu'ils sont tenus de subir avant d'obtenir
un permis, qu'ils sont atteints d'une ou plusieurs des incapacités mentionnées
pour ce qui est de ce groupe dans la présente annexe. 4\. Groupe 2 : les
candidats doivent faire l'objet d'un examen médical avant la délivrance
initiale d'un permis et, par la suite, les conducteurs doivent subir les
examens périodiques qui pourraient être prescrits par la législation
nationale. Capacité visuelle 5\. Tous les candidats à un permis de conduire
doivent subir un examen confié à un personnel convenablement formé. Dans les
cas douteux, le candidat doit être examiné par une autorité médicale
compétente. Lors de l'examen de la vue, l'attention doit porter sur l'acuité
visuelle, le champ visuel, la vision nocturne, les maladies oculaires
progressives, etc. Lorsque le port de verres correcteurs est reconnu
nécessaire pour la conduite par l'autorité qui délivre les permis, ce fait
doit être consigné sur le permis de conduire. 6\. Groupe 1 : les conducteurs
de ce groupe devraient subir un examen de la vue au plus tard à l'âge de 70
ans, et de préférence plus tôt, et ensuite à intervalles appropriés. Si des
candidats ou des conducteurs de 40 ans ou plus ont, après correction, une
vision inférieure à la normale, tout en satisfaisant aux conditions minimales
indiquées aux paragraphes 6.1. et 6.2. ci-après, on recherchera la cause de la
diminution de la vision avant de délivrer ou de renouveler le permis.
Lorsqu'une maladie oculaire est décelée ou suspectée, les examens périodiques
devraient être fréquents. 6.1. Les candidats à la délivrance ou au
renouvellement d'un permis de conduire doivent avoir une acuité visuelle, avec
verres correcteurs s'il y a lieu, d'au moins 0,4, et de préférence d'une
valeur supérieure à ce chiffre pour l'œil le meilleur ou d'au moins 0,5 pour
les deux yeux ensemble, et d'une valeur, constatée lors d'un examen médical,
d'au moins 0,2 pour l'œil le moins bon. Le permis de conduire ne doit être ni
délivré, ni renouvelé s'il s'avère après examen médical que la vision du
candidat ou du conducteur est diminuée de plus de 20 degrés dans la partie
temporaire de son champ de vision ou si l'intéressé est atteint de diplopie ou
d'un défaut de vision binoculaire. 6.2. Les candidats ou conducteurs qui ne
voient que d'un oeil peuvent obtenir un permis de conduire ou le
renouvellement de ce permis à condition qu'une autorité médicale compétente
certifie que cette condition de vision monoculaire existe depuis assez
longtemps pour que l'intéressé s'y soit adapté, et que l'acuité visuelle, avec
verres correcteurs s'il y a lieu, soit d'au moins 0,8. Ces personnes ne
doivent avoir aucune limitation de champ de vision pour cet œil. 7\. Groupe 2
: les candidats et les conducteurs de ce groupe doivent subir un examen de la
vue lors de la demande de la délivrance du permis de conduire, et de
préférence périodiquement par la suite. Si des candidats ou des conducteurs
âgés de 40 ans ou plus ont une vision corrigée inférieure à la normale tout en
satisfaisant aux conditions minimales indiquées au paragraphe 7.1 ci après, on
cherchera la cause de la diminution de la vision avant de délivrer ou de
renouveler le permis. 7.1. Les candidats à la délivrance ou au renouvellement
d'un permis doivent avoir une vision binoculaire assortie d'une acuité
visuelle, avec verres correcteurs s'il y a lieu, d'au moins 0,75 pour l'oeil
le meilleur et d'au moins 0,5 pour l'œil le moins bon. Si l'intéressé utilise
des verres correcteurs, la vision, non corrigée, ne doit pas être inférieure à
0,1, la correction étant bien tolérée. Le permis de conduire ne doit être ni
délivré ni renouvelé si le candidat ou conducteur a un champ visuel diminué ou
s'il est atteint de diplopie ou d'une vision binoculaire défectueuse. 7.2.
L'emploi de verres de contact par les conducteurs de ce groupe peut être
autorisé sur avis favorable d'une autorité médicale compétente. Audition 8\.
Le permis de conduire ne doit être ni délivré ni renouvelé à un candidat ou
conducteur du groupe 2 si son audition est si mauvaise qu'il en est gêné dans
l'accomplissement de ses tâches. Etat général et incapacités physiques 9\.
Groupe 1 : le permis de conduire sans condition restrictive ne doit pas être
délivré ou renouvelé aux candidats ou conducteurs physiquement diminués tant
qu'ils n'ont pas satisfait à un examen de conduite prouvant qu'ils sont
capables de conduire un véhicule pourvu des commandes de type habituel. 9.1.
Des permis de conduire avec condition restrictive peuvent être délivrés ou
renouvelés aux candidats ou aux conducteurs physiquement diminués si les
véhicules qu'ils conduisent sont adaptés aux besoins de leur condition. Toute
restriction portée sur le permis de conduire doit préciser le type
d'aménagement requis sur le véhicule. 9.2. En cas de doute, le candidat subira
une épreuve pratique qui permettra de s'assurer de ses aptitudes, après examen
médical par une autorité compétente, et un permis de validité limitée pourra
être alors délivré, s'il y a lieu, de façon à permettre de suivre le cas.
L'évaluation des incapacités physiques doit reposer essentiellement sur des
considérations mécaniques permettant de déterminer si l'incapacité constatée
risque, pendant un temps prolongé, d'empêcher une manoeuvre efficace et rapide
et de gêner le maniement des commandes en toutes circonstances, et notamment
en cas d'urgence. 10 Groupe 2 : le permis de conduire ne doit être ni délivré
ni renouvelé aux candidats ou conducteurs atteints d'une incapacité qui risque
d'empêcher la conduite correcte et sans danger d'un véhicule. 10.1. L'examen
médical des candidats ou conducteurs doit porter sur l'ensemble des mouvements
du corps - force musculaire, contrôle et coordination - en particulier pour
les membres supérieurs et inférieurs. 10.2. Lorsqu'une incapacité qui risque
d'empêcher la conduite correcte et sans danger d'un véhicule survient
postérieurement à la délivrance du permis, le conducteur doit interrompre son
activité et subir un examen effectué par une autorité médicale compétente.
Affectations cardio-vasculaires 11\. Le permis de conduire ne doit être
délivré ni renouvelé aux candidats ou conducteurs atteints d'une affection
cardio-vasculaire sauf si la demande est appuyée par un avis médical autorisé.
12\. En ce qui concerne les candidats ou conducteurs du groupe 2, l'autorité
compétente tiendra dûment compte des risques ou dangers additionnels liés à la
conduite des véhicules qui entrent dans la définition de ce groupe. Troubles
endocriniens 13\. En cas de troubles endocriniens graves autres que le
diabète, la législation des divers pays doit comporter des dispositions
appropriées concernant la délivrance ou le renouvellement des permis de
conduire. 14\. Groupe 1 : le permis de conduire ne doit être ni délivré, ni
renouvelé aux candidats ou conducteurs diabétiques atteints de complications
oculaires, nerveuses ou cardio-vasculaires, ou d'acidose non compensée. 14.1.
Le permis de conduire peut être délivré ou renouvelé pour une période
limitées, aux candidats ou conducteurs diabétiques qui ne sont atteints
d'aucune des complications mentionnées au paragraphe 14., à condition qu'ils
demeurent sous surveillance médicale. 15\. Groupe 2 : le permis de conduire ne
doit être ni délivré, ni renouvelé aux candidats ou conducteurs diabétiques
ayant besoin d'un traitement par l'insuline. Maladies du système nerveux 16\.
Le permis de conduire ne doit être ni délivré, ni renouvelé aux candidats ou
conducteurs atteints : a) d'encéphalite, de sclérose en plaques, de myasthénie
grave ou de maladies héréditaires du système nerveux, associées à une atrophie
musculaire progressive et à des troubles myotoniques congénitaux ; b) de
maladies du système nerveux périphérique ; ou c) de traumatisme du système
nerveux, central ou périphérique, sauf si la demande est appuyée par un avis
médical autorisé et si les intéressés sont capables de manoeuvrer les
commandes d'un véhicule dans des conditions de sécurité et de respecter les
règles de la circulation. Ces cas sont à réexaminer périodiquement. 17\.
Groupe 1 : le permis de conduire ne doit être ni délivré, ni renouvelé aux
candidats ou conducteurs épileptiques. La législation nationale peut prévoir
que, sous réserve d'un avis médical autorisé, un permis peut être délivré à
une personne ayant souffert d'épilepsie dans le passé, mais qui n'a plus eu de
crise depuis longtemps (deux ans par exemple). 17.1. Le permis de conduire ne
doit être ni délivré, ni renouvelé aux candidats ou conducteurs atteints de
maladies cérébro-vasculaires, sauf si leur demande est appuyée par un avis
médical autorisé et à condition que les commandes du véhicule soient aménagées
ou modifiées dans la mesure nécessaire, ou qu'un véhicule convenable de type
spécial soit utilisé. La durée de validité des permis de conduire ainsi
délivrés ou renouvelés doit être limitée conformément à un avis médical
autorisé. 17.2. Le permis de conduire ne doit être ni délivré, ni renouvelé
aux candidats ou conducteurs atteints d'une lésion de la moelle épinière ayant
entraîné une paraplégie, à moins que le véhicule ne soit pourvu de commandes
spéciales. 18\. Groupe 2 : le permis de conduire ne doit être ni délivré, ni
renouvelé aux candidats ou conducteurs atteints ou ayant souffert dans le
passé d'épilepsie, d'une maladie cérébro-vasculaire ou d'une lésion de la
moelle épinière ayant entraîné une paraplégie. Troubles mentaux 19\. Le permis
de conduire ne doit être ni délivré, ni renouvelé aux candidats ou conducteurs
: a) atteints de troubles mentaux dus à des maladies, traumatisme ou
opérations du système nerveux central ; b) atteints d'arriération mentale
grave ; c) souffrant de psychose, ayant notamment provoqué paralysie générale
; ou d) souffrant de troubles neuropsychiques ou de troubles la personnalité,
sauf si la demande est appuyée par un avis médical autorisé. 20\. En ce qui
concerne les candidats ou conducteurs du groupe 2, l'autorité médicale
compétente tiendra dûment compte des risques ou dangers additionnels liés à la
conduite des véhicules qui entrent dans la définition de ce groupe. Alcool
21\. Le permis de conduire ne doit être ni délivré, ni renouvelé aux candidats
ou conducteurs alcooliques chronique. Si la demande est appuyée par un avis
médical autorisé, le permis de conduire peut être délivré ou renouvelé pour
une période limitée aux candidats ou conducteurs qui, dans le passé, ont été
alcooliques chroniques. Ces cas doivent être réexaminés périodiquement. 22\.
En ce qui concerne les candidats ou conducteurs du groupe 2, l'autorité
médicale compétente tiendra dûment compte des risques et dangers additionnels
liés à la conduite des véhicules qui entrent dans la définition de ce groupe.
Drogues et médicaments 23\. Abus des drogues : le permis de conduire ne doit
être ni délivré, ni renouvelé aux candidats ou conducteurs en état de
dépendance vis-à-vis de substances psychotropes. 24\. Drogues ou médicaments
consommés régulièrement : le permis de conduire ne doit être ni délivré, ni
renouvelé aux candidats ou conducteurs qui consomment régulièrement des
drogues pharmaceutiques ou des médicament, susceptibles de compromettre leur
aptitude à conduire sans danger, sauf si leur demande est appuyée par un avis
médical autorisé. 24.1. En ce qui concerne les candidats ou conducteurs groupe
2, l'autorité médicale compétente tiendra dûment compte des risques et dangers
additionnels liés à la conduite des véhicules sur lesquels porte la définition
de ce groupe. Maladies du sang 25\. Le permis de conduire ne doit être ni
délivré, ni renouvelé aux candidats ou conducteurs atteints de graves maladies
du sang, sauf si la demande est appuyée par un avis médical autorisé. Maladies
de l'appareil génito-urinaire 26\. Le permis de conduire ne sera ni accordé,
ni renouvelé aux candidats ou conducteurs souffrant d'une déficience rénale
grave. Retrait des permis de conduire 27\. La législation nationale devra
contenir des dispositions prévoyant que le permis de conduire sera retiré,
sous réserve d'un avis médical autorisé, lorsque les autorités compétentes
auront appris que l'état de santé de son titulaire est tel qu'il aurait
entraîné le rejet d'une demande de permis de conduire ou de renouvellement
d'un tel permis **** ### Source: URL: https://juridiahackhaton.blob.core.windows.net/fine-tuning/documents/15707.html type: Dahir date_publication: 1986-11-14 title: Dahir n° 1-83-271 du 11 rebia I 1407 (14 novembre 1986) portant publication de l'accord sur les exigences minimales pour la délivrance et la validité des permis de conduire (APC), fait à Genève le 1er avril 1975."
