Question,Answer,Context
créer, modifier ou supprimer ; \- les dispositions relatives aux charges de
l'Etat, aux services de l'Etat gérés de manière autonome et aux comptes
spéciaux du Trésor ; \- les dispositions relatives au recouvrement des
créances publiques, au contrôle de l'emploi des fonds publics et à la
responsabilité pécuniaire et personnelle des gestionnaires des services de
l'Etat, le cas échéant ; \- l'évaluation globale des recettes du budget
général, des budgets des services de l'Etat gérés de manière autonome et des
catégories des comptes spéciaux du Trésor ; \- les plafonds des charges du
budget général, par titre, de l'ensemble des budgets des services de l'Etat
gérés de manière autonome groupées par dépenses d'exploitation et dépenses
d'investissement et des comptes spéciaux du Trésor, par catégorie. Le tableau
d'équilibre est présenté de manière à faire ressortir l'intégralité des
éléments de l'équilibre budgétaire et des besoins de financement. La deuxième
partie arrête : \- par chapitre, les dépenses du budget général ; \- par
service, les dépenses des services de l'Etat gérés de manière autonome ; \- et
par compte, les dépenses des comptes spéciaux du Trésor. **** **  
Article 37 :** Les ressources du budget général sont présentées en chapitres
subdivisés, s'il y a lieu, par service et par nature de recettes. Les
ressources des services de l'Etat gérés de manière autonome sont présentées
par service groupés selon les départements ministériels ou institutions
auxquels ils sont rattachés. Les ressources des comptes spéciaux du Trésor
sont présentées à l'intérieur de chaque catégorie par compte spécial du
Trésor. **** **  
Article 38 :**(1) Les dépenses du budget général sont groupées sous trois
titres : Titre I : dépenses de fonctionnement ;  Titre II : dépenses
d'investissement ; Titre III : dépenses relatives au service de la dette
publique. (2) Les dépenses du budget général sont présentées, à l'intérieur
des titres, par chapitres, subdivisés en programmes, régions et projets ou
actions. Les dépenses des services de l'Etat gérés de manière autonomes sont
présentées, à l'intérieur de chaque chapitre, dans un programme et, le cas
échéant, dans des programmes subdivisés en régions et projets ou actions. Les
dépenses des comptes d'affectation spéciale sont présentées dans un programme
et, le cas échéant, dans des programmes subdivisés en régions et projets ou
actions. (3) Pour chaque département ministériel ou institution, il est prévu,
en ce qui concerne les dépenses de fonctionnement, un chapitre pour le
personnel et un chapitre pour le matériel et les dépenses diverses. Il est
prévu pour les dépenses d'investissement un chapitre par département
ministériel ou institution. **** **  
Article 39 :** Un programme est un ensemble cohérent de projets ou actions
relevant d'un même département ministériel ou d'une même institution et auquel
sont associés des objectifs définis en fonction des finalités d'intérêt
général ainsi que des indicateurs chiffrés permettant de mesurer les résultats
escomptés et faisant l'objet d'une évaluation qui vise à s'assurer des
conditions d'efficacité, d'efficience et de qualité liées aux réalisations. Un
responsable par programme, désigné au sein de chaque département ministériel
ou institution, est chargé de définir les objectifs et indicateurs dudit
programme et d'assurer le suivi de sa mise en œuvre. Les objectifs d'un
programme et les indicateurs y afférents sont repris dans le projet de
performance élaboré par le département ministériel ou l'institution concerné.
Ledit projet de performance est présenté à la commission parlementaire
concernée, en accompagnement du projet du budget dudit département ministériel
ou institution. L'aspect genre est pris en considération lors de la fixation
des objectifs et des indicateurs cités ci-dessus. Les crédits afférents à un
programme sont répartis, selon le cas, à l'intérieur : \- des chapitres
relatifs au budget du département ministériel ou institution concerné ; \- des
chapitres relatifs aux services de l'Etat gérés de manière autonome rattachés
au département ministériel ou institution concerné; \- des comptes
d'affectation spéciale rattachés au département ministériel ou institution
concerné. **** **  
Article 40 :** Un projet ou une action est un ensemble délimité d'activités et
d'opérations entreprises dans le but de répondre à un ensemble de besoins
définis. Les crédits afférents à un projet ou à une action d'un même programme
sont répartis, selon le cas, à l'intérieur : \- des chapitres relatifs au
budget du département ministériel ou institution concerné ; \- des chapitres
relatifs aux services de l'Etat gérés de manière autonome rattachés au
département ministériel ou institution concerné ; \- des comptes d'affectation
spéciale rattachés au département ministériel ou institution concerné. **** **  
Article 41 :** Un projet ou une action est décliné en lignes budgétaires qui
renseignent sur la nature économique des dépenses afférentes aux activités et
opérations entreprises. La déclinaison des projets ou actions en lignes est
présentée dans le projet de loi de règlement de la loi de finances soumis au
Parlement. **** **  
Article 42 :** Sont ouverts au titre I du budget général : \- le chapitre des
dépenses imprévues et des dotations provisionnelles, qui n'est affecté à aucun
service. Des prélèvements peuvent être opérés en cours d'année sur ce chapitre
pour assurer, par un crédit complémentaire, la couverture de besoins urgents
ou non prévus lors de l'établissement du budget ; \- le chapitre des dépenses
relatives aux remboursements, dégrèvements et restitutions, fiscaux. **** **  
Article 43 :** Un chapitre des charges communes est ouvert aux titres I et II
du budget général, pour la prise en charge des dépenses y afférentes et qui ne
peuvent comprendre que les charges ne pouvant être imputées sur les budgets
des départements ministériels ou institutions. **** **  
Article 44 :** Les dépenses relatives à la dette publique sont présentées en
deux chapitres : \- le premier comporte les dépenses en intérêts et
commissions se rapportant à la dette publique ; \- le second comporte les
dépenses relatives aux amortissements de la dette publique à moyen et long
termes. **  
Article 45 :** Les virements de crédits entre chapitres sont interdits. Des
virements de crédits peuvent être effectués à l'intérieur d'un programme et
entre les programmes d'un même chapitre dans les conditions et selon les
modalités fixées par voie réglementaire. **** **  
Titre III : De l'examen et du vote des lois de finances** **** **Chapitre**
**premier : De l'examen des lois de finances** **** **Article 46 :** Sous
l'autorité du Chef du Gouvernement, le ministre chargé des finances prépare
les projets de lois de finances conformément aux orientations générales ayant
fait l'objet de délibérations au Conseil des ministres conformément à
l'article 49 de la Constitution. **** **  
Article 47 :** Le Ministre chargé des finances expose aux commissions des
finances du Parlement, avant le 31 juillet, le cadre général de préparation du
projet de loi de finances de l'année suivante. Cet exposé comporte : (a)
l'évolution de l'économie nationale ; (b) l'état d'avancement de l'exécution
de la loi de finances en cours à la date du 30 juin ; (c) les données
relatives à la politique économique et financière ; (d) la programmation
budgétaire triennale globale. Ledit exposé donne lieu à un débat sans vote.
**** **  
Article 48 :** Le projet de loi de finances de l'année est déposé sur le
bureau de la Chambre des représentants, au plus tard le 20 octobre de l'année
budgétaire en cours. Il est accompagné des documents suivants : (1) note de
présentation de la loi de finances comportant des données concernant les
investissements du budget général ainsi que les impacts financiers et
économiques des dispositions fiscales et douanières proposées; (2) rapport
économique et financier ; (3) rapport sur les établissements et entreprises
publics ; (4) rapport sur les services de l'Etat gérés de manière autonome ;
(5) rapport sur les comptes spéciaux du Trésor ; (6) rapport sur les dépenses
fiscales ; (7) rapport sur la dette publique ; (8) rapport sur le budget axé
sur les résultats tenant compte de l'aspect genre ; (9) rapport sur les
ressources humaines ; (10) rapport sur la compensation ; (11) note sur les
dépenses relatives aux charges communes ; (12) rapport sur le foncier public
mobilisé pour l'investissement ; (13) note sur la répartition régionale de
l'investissement. Le projet de loi de finances de l'année peut être également
accompagné d'un rapport sur les comptes consolidés du secteur public. Il est
immédiatement soumis à l'examen de la commission chargée des finances de la
Chambre des représentants. La programmation pluriannuelle des départements
ministériels ou institutions, ainsi que celle des établissements et
entreprises publics soumis à leur tutelle et bénéficiant de ressources
affectées ou de subventions de l'Etat, est présentée, pour information, aux
commissions parlementaires concernées en accompagnement des projets de budgets
desdits départements ministériels ou institutions. **** **  
Article 49 :** La Chambre des représentants se prononce sur le projet de loi
de finances de l'année dans un délai de trente (30) jours suivant la date de
son dépôt. Dès le vote du projet ou à l'expiration du délai prévu à l'alinéa
précédent, le Gouvernement saisit la Chambre des conseillers du texte adopté
ou du texte qu'il a initialement présenté, modifié, le cas échéant, par les
amendements votés par la Chambre des représentants et acceptés par lui. La
Chambre des conseillers se prononce sur le projet dans un délai de vingt deux
(22) jours suivant sa saisine. La Chambre des représentants examine les
amendements votés par la Chambre des conseillers et adopte en dernier ressort
le projet de loi de finances dans un délai n'excédant pas six (6) jours. ****
**  
Article 50 :** Conformément à l'article 75 de la Constitution, si au 31
décembre, la loi de finances de l'année n'est pas votée ou n'est pas
promulguée en raison de sa soumission à la Cour Constitutionnelle, le
gouvernement ouvre, par décret, les crédits nécessaires à la marche des
services publics et à l'exercice de leur mission, en fonction des propositions
budgétaires soumises à approbation. Dans ce cas, les recettes continuent à
être perçues conformément aux dispositions législatives et réglementaires en
vigueur les concernant à l'exception, toutefois, des recettes dont la
suppression est proposée dans le projet de loi de finances. Quant à celles
pour lesquelles ledit projet prévoit une diminution de taux, elles seront
perçues au nouveau taux proposé. Pour l'application de l'alinéa précédent, les
dispositions relatives aux recettes dont la suppression est proposée dans le
projet de loi de finances ainsi que celles pour lesquelles ledit projet
prévoit une diminution de taux sont reprises dans un décret. Il est mis fin à
l'application desdits décrets dès l'entrée en vigueur de la loi de finances.
**** **  
Article 51 :** Le projet de loi de finances rectificative est voté par le
Parlement dans un délai n'excédant pas quinze (15) jours après son dépôt par
le Gouvernement sur le bureau de la Chambre des représentants. La Chambre des
représentants se prononce sur le projet de loi de finances rectificative dans
un délai de huit (8) jours suivant la date de son dépôt. Dès le vote dudit
projet ou à l'expiration du délai prévu à l'alinéa précédent, le Gouvernement
saisit la Chambre des conseillers du texte adopté ou du texte qu'il a
initialement présenté, modifié, le cas échéant, par les amendements votés par
la Chambre des représentants et acceptés par lui. La Chambre des conseillers
se prononce sur le projet dans un délai de quatre (4) jours suivant sa
saisine. La Chambre des représentants examine les amendements votés par la
Chambre des conseillers et adopte en dernier ressort le projet de loi de
finances rectificative dans un délai n'excédant pas trois (3) jours. **** **  
Chapitre II : Du vote de la loi de finances** **** **Article 52 :** La seconde
partie du projet de loi de finances de l'année ne peut être soumise au vote de
l'une des deux Chambres du Parlement avant le vote de la première partie. Dans
le cas où la première partie est rejetée, la seconde partie ne peut être
soumise au vote. Le rejet de la première partie par l'une des deux Chambres du
Parlement est considéré comme rejet du projet dans son ensemble par la même
Chambre. En cas de rejet du projet par la Chambre des conseillers, la Chambre
des représentants est saisie pour examen, dans le cadre de la deuxième
lecture, du texte rejeté par la Chambre des conseillers. **** **  
Article 53 :** Les dispositions de la loi de finances sont votées article par
article. Toutefois, l'une des deux Chambres du Parlement peut procéder au vote
d'ensemble de la deuxième partie à la demande du Gouvernement ou du bureau de
la Chambre concernée. **** **  
Article 54 :** Les évaluations de recettes font l'objet d'un vote d'ensemble
pour le budget général et les budgets des services de l'Etat gérés de manière
autonome et d'un vote par catégorie pour les comptes spéciaux du Trésor. ****
**  
Article 55 :** Les dépenses du budget général font l'objet d'un vote par titre
et à l'intérieur d'un même titre par chapitre. Les dépenses des budgets des
services de l'Etat gérés de manière autonome font l'objet d'un vote d'ensemble
par département ministériel ou institution auquel ils sont rattachés. Les
dépenses des comptes spéciaux du Trésor sont votées par catégorie de comptes
spéciaux. **** **  
Article 56 :** Conformément au 2eme alinéa de l'article 77 de la Constitution,
le Gouvernement peut opposer, de manière motivée, l'irrecevabilité à des
articles additionnels ou amendements ayant pour objet soit une diminution de
ressources publiques, soit la création ou l'aggravation d'une charge publique.
S'agissant des articles additionnels ou amendements, la charge publique
s'entend des crédits ouverts au titre du chapitre. A l'intérieur d'un même
chapitre, des articles additionnels ou amendements, qui doivent être justifiés
et accompagnés des ajustements nécessaires aux objectifs et indicateurs
relatifs aux programmes concernés, peuvent augmenter ou diminuer les crédits
afférents à un programme, dans la limite des crédits prévus au titre dudit
chapitre. Les amendements non conformes aux dispositions de la présente loi
organique sont irrecevables. Tout autre article additionnel ou amendement doit
être justifié. **** **  
Article 57 :** Les lois de finances rectificatives sont présentées et votées
dans les mêmes formes que la loi de finances de l'année sous réserve de
l'article 51 ci-dessus. **** **  
Chapitre III : De la portée de l'autorisation parlementaire** **** **Article
58 :** Les crédits ouverts sont limitatifs. Les dépenses ne peuvent être
engagées, ordonnancées et payées que dans la limite des crédits ouverts. Pour
les dépenses de personnel, elles ne peuvent être engagées, ordonnancées et
payées que dans la limite des crédits ouverts au titre du chapitre. Toutefois,
les crédits relatifs aux dépenses se rapportant à la dette publique et à la
dette viagère et aux remboursements, dégrèvements et restitutions, fiscaux,
ont un caractère évaluatif. Ces dépenses peuvent s'imputer au-delà des
dotations inscrites aux rubriques qui les concernent. Les dépassements ### Source: URL: https://juridiahackhaton.blob.core.windows.net/fine-tuning/documents/32609.html type: Dahir date_publication: 2015-06-02 title: Dahir n° 1-15-62 du 14 chaabane 1436 (2 juin 2015) portant promulgation de la loi organique n° 130-13 relative à la loi de finances."
"Quels sont les délais impartis au Parlement pour l'examen et le vote du projet de loi de finances de l'année, selon l'article 49 ?","Absolument ! Voici les délais impartis au Parlement pour l'examen et le vote du projet de loi de finances de l'année, tels que définis à l'article 49 :

**Chambre des Représentants :**

*   La Chambre des représentants dispose d'un délai de **trente (30) jours** à compter de la date de dépôt du projet de loi de finances pour se prononcer sur celui-ci.

**Chambre des Conseillers :**

*   Une fois que la Chambre des représentants a voté le projet (ou que le délai de 30 jours est écoulé), le gouvernement saisit la Chambre des conseillers. Cette dernière a un délai de **vingt-deux (22) jours** pour se prononcer sur le projet.

**Retour à la Chambre des Représentants :**

*   Après l'examen par la Chambre des conseillers, le projet retourne à la Chambre des représentants. Celle-ci doit examiner les amendements votés par la Chambre des conseillers et adopter en dernier ressort le projet de loi de finances dans un délai n'excédant pas **six (6) jours**.

**En résumé :**

*   **Chambre des Représentants (1ère lecture) :** 30 jours
*   **Chambre des Conseillers :** 22 jours
*   **Chambre des Représentants (2ème lecture) :** 6 jours

Il est important de noter que ces délais sont impératifs. Si la loi de finances n'est pas votée dans ces délais, des dispositions spécifiques sont prévues (article 50).
","### Context: ---  
**Bulletin Officiel n° 6370 du 18 juin 2015**  
**EDITION DE TRADUCTION OFFICIELLE**  
****  
|  **Dahir n° 1-15-62 du 14 chaabane 1436 (2 juin 2015) portant promulgation
de la loi organique n° 130-13 relative à la loi de finances.** **** **LOUANGE
A DIEU SEUL !** __ _(Grand Sceau de Sa Majesté Mohammed VI)_ __ Que l'on sache
par les présentes - puisse Dieu en élever et en fortifier la teneur ! Que
Notre Majesté Chérifienne, Vu la Constitution, notamment ses articles 42 50 85
et 132 ; Vu la décision du Conseil Constitutionnel n° 961/15 du 29 rejeb 1436
(18 mai 2015) par laquelle il déclare que les dispositions de la loi organique
n° 130-13 relative à la loi de finances ne sont pas contraires à la
Constitution , **** **A décidé ce qui suit :** **** Est promulguée et sera
publiée au Bulletin officiel, à la suite du présent dahir, la loi organique n°
130-13 relative à la loi de finances, telle qu'adoptée par la Chambre des
représentants et la Chambre des conseillers. _Fait à Rabat, le 14 chaabane
1436 (2 juin 2015)._ Pour contreseing : _Le Chef du gouvernement,_ **Abdel-
Ilah Benkiran.** **Loi organique n° 130-13 relative à la loi de finances**
**** **Titre premier : de la définition et du contenu des lois de finances**
**** **Chapitre premier : Des lois de finances et des principes budgétaires**
**** **  
Article Premier :** La loi de finances détermine, pour chaque année
budgétaire, la nature, le montant et l'affectation de l'ensemble des
ressources et des charges de l'Etat, ainsi que l'équilibre budgétaire et
financier qui en résulte. Elle tient compte de la conjoncture économique et
sociale qui prévaut au moment de sa préparation, ainsi que des objectifs et
des résultats des programmes qu'elle détermine. **** **  
Article 2 :** Au sens de la présente loi organique, on entend par loi de
finances : \- la loi de finances de l'année ; \- les lois de finances
rectificatives ; \- la loi de règlement de la loi de finances. **** **  
Article 3 :** La loi de finances de l'année prévoit, évalue, énonce et
autorise, pour chaque année budgétaire, l'ensemble des ressources et des
charges de l'Etat, par référence à la programmation budgétaire prévue à
l'article 5 ci-dessous. L'année budgétaire commence le 1er janvier et se
termine le 31 décembre de la même année. **** **  
Article 4 :** Seules des lois de finances rectificatives peuvent en cours
d'année modifier les dispositions de la loi de finances de l'année. **** **  
Article 5 :** La loi de finances de l'année est élaborée par référence à une
programmation budgétaire triennale actualisée chaque année en vue de l'adapter
à l'évolution de la conjoncture financière, économique et sociale du pays.
Cette programmation vise notamment à définir, en fonction d'hypothèses
économiques et financières réalistes et justifiées, l'évolution sur trois ans
de l'ensemble des ressources et des charges de l'Etat. Le contenu et les
modalités d'élaboration de cette programmation sont fixés par voie
réglementaire. **** **  
Article 6 :** Les lois de finances ne peuvent contenir que des dispositions
concernant les ressources et les charges ou tendant à améliorer les conditions
de recouvrement des recettes et le contrôle de l'emploi des fonds publics.
**** **  
Article 7 :** Les dispositions des traités de commerce, des conventions ou des
accords, engageant les finances de l'Etat, et celles relatives aux garanties
accordées par l'Etat, à la gestion de la dette publique ainsi que de la dette
viagère, aux autorisations d'engagement par anticipation pour lesquelles les
crédits doivent être ouverts au titre de l'année budgétaire suivante, aux
crédits d'engagement et aux programmes pluriannuels, peuvent engager
l'équilibre financier des années budgétaires ultérieures. **** **  
Article 8 :** Il est fait recette du montant intégral des produits, sans
contraction entre les recettes et les dépenses, l'ensemble des recettes
assurant l'exécution de l'ensemble des dépenses. Toutes les recettes et toutes
les dépenses sont imputées au budget général. Peuvent être intégrées parmi les
composantes du budget de l'Etat, les recettes et les dépenses relatives à la
gestion des fonds publics résultant de certains comptes de trésorerie et qui
sont fixés par la loi de finances selon les conditions prévues par voie
réglementaire. Toutefois, certaines recettes peuvent être affectées à
certaines dépenses dans le cadre des budgets des services de l'Etat gérés de
manière autonome, des comptes spéciaux du Trésor ou de procédures comptables
particulières telles que prévues aux articles 34 et 35 ci-dessous. **** **  
Article 9 :** Le solde budgétaire prévisionnel est fixé notamment sur la base
des hypothèses selon lesquelles le projet de loi de finances de l'année a été
élaboré. Le solde budgétaire prévisionnel est calculé sur la base de la
différence entre les ressources hors produits des emprunts, et les charges
hors dépenses relatives aux amortissements de la dette à moyen et long terme.
**** **  
Article 10 :** Les lois de finances présentent de façon sincère l'ensemble des
ressources et des charges de l'État. La sincérité des ressources et des
charges s'apprécie compte tenu des informations disponibles au moment de leur
établissement et des prévisions qui peuvent en découler. **** **  
Chapitre II : De la détermination des ressources et des charges de l'Etat**
**** **Section première. - Des ressources de l'Etat** **** **Article 11 :**
Les ressources de l'Etat comprennent : \- les impôts et taxes ; \- le produit
des amendes ; \- les rémunérations de services rendus et les redevances ; \-
les fonds de concours, dons et legs ; \- les revenus du domaine de l'Etat ; \-
le produit de cession des biens meubles et immeubles ; \- le produit des
exploitations, les redevances et les parts de bénéfices ainsi que les
ressources et les contributions financières provenant des établissements et
entreprises publics ; \- les remboursements de prêts et avances et les
intérêts y afférents ; \- le produit des emprunts ; \- les produits divers. La
rémunération des services rendus par l'Etat est instituée par décret pris sur
proposition du ministre intéressé et du ministre chargé des finances. **** **  
Section 2 : Des charges de l'Etat** **** **Article 12 :** Les charges de
l'Etat comprennent :  \- les dépenses du budget général ; \- les dépenses des
budgets des services de l'Etat gérés de manière autonome ; \- les dépenses des
comptes spéciaux du Trésor. **** **  
Chapitre III : Du budget général** **** **Article 13 :** Le budget général
comporte deux parties : la première partie concerne les ressources et la
seconde est relative aux charges. Les ressources du budget général comprennent
les ressources visées à l'article 11 ci-dessus. Les charges du budget général
comprennent les dépenses de fonctionnement, les dépenses d'investissement et
les dépenses relatives au service de la dette publique. **** **  
Article 14 :** Les dépenses de fonctionnement comprennent : \- les dotations
des pouvoirs publics ; \- les dépenses de personnel et du matériel afférentes
au fonctionnement des services publics ; \- les dépenses diverses relatives à
l'intervention de l'Etat notamment en matière administrative, économique,
sociale et culturelle et environnementale ; \- les dépenses relatives à
l'exécution des arrêts et décisions judiciaires prononcés à l'encontre de
l'Etat ; \- les dépenses de la dette viagère ; \- les dépenses relatives aux
charges communes ; \- les dépenses relatives aux remboursements, dégrèvements
et restitutions, fiscaux ; \- les dépenses imprévues et les dotations
provisionnelles. **** **  
Article 15 :** Les dépenses de personnel comprennent :  \- les traitements,
salaires et indemnités, \- et les cotisations de l'Etat au titre de la
prévoyance sociale et de la retraite. **** **  
Article 16 :** Les crédits ouverts au titre des dépenses de fonctionnement
