Question,Answer,Context
ما هي الصلاحيات التي يتمتع بها مجلس كل كلية أو معهد في الجامعة؟,"يُحدد الفصل الرابع من المادة 29 من هذا الداِير صلاحيات مجلس كل كلية أو معهد في الجامعة، وهي:

1. **فحص الميزانية المقترحة:**  يُعرض عليه مشروع الميزانية، ويُطلب منه إبداء الرأي.

2. **النظر في تنظيم التعليم والمنهجية:**  يُطلب منه إبداء الرأي في تنظيم التعليم والمنهجية.

3. **النظر في البرامج التعليمية والبحثية:**  يُطلب منه إبداء الرأي في البرامج التعليمية والبحثية.

4. **النظر في عمل الأقسام:**  يُطلب منه النظر في تقارير عمل الأقسام.

5. **اقتراح الإجراءات لتحسين الأداء العلمي:**  له الحق في اقتراح الإجراءات التي من شأنها أن تساهم في تطوير وتنمية الحياة العلمية داخل الكلية أو المعهد.

6. **مجلس تأديبي للطلاب:**  يُعتبر مجلس الكلية أو المعهد مجلسًا تأديبيًا للطلاب، وفقًا لما هو مُحدد في القرارات.
","### Context: ---  
**Bulletin officiel n° 3252 du 26 février 1975**  
**EDITION DE TRADUCTION OFFICIELLE**  
****  
**Dahir portant loi n° 1-75-102 du 13 safar 1395 (25 février 1975) relatif à
l'organisation des universités.** **** **LOUANGE A DIEU SEUL !** _(Grand Sceau
de Sa Majesté Hassan II)_ Que l'on sache par les présentes - Puisse Dieu en
élever et en fortifier la teneur ! Que Notre Majesté Chérifienne, Vu l'article
102 de la Constitution, **A décidé ce qui suit :** **Titre premier : De
l'université** **** **Chapitre premier : Mission et création** **** **Article
Premier :** Les universités ont pour mission de dispenser l'enseignement
supérieur, de promouvoir la recherche scientifique, de former des cadres et de
contribuer à la diffusion de la connaissance. **Article 2 :** Les universités
constituent des établissements publics dotés de la personnalité morale et de
l'autonomie budgétaire telles que déterminées par le présent dahir. Elles sont
placées sous la tutelle de l'autorité gouvernementale chargée de
l'enseignement supérieur. **Article 3 :** Chaque université peut comprendre,
outre les services communs du rectorat, des établissements universitaires :
facultés ou écoles ainsi que des instituts spécialisés répondant à des besoins
particuliers de la recherche. Pour chaque faculté, des centres d'études
peuvent être créés en dehors du siège principal, suivant les besoins de
l'enseignement et de la recherche. **Article 4 :** Les universités sont créées
par la loi. Les établissements universitaires sont créés par décret pris sur
proposition de l'autorité gouvernementale chargée de l'enseignement supérieur
et les centres d'études par arrêté de l'autorité gouvernementale chargée de
l'enseignement supérieur. La création des cités universitaires, leur
implantation, leur mode de gestion et leur fonctionnement sont fixés par
décret pris sur proposition de l'autorité gouvernementale chargée de
l'enseignement supérieur. **Article 5 :** L'université est dirigée par un
recteur et dotée d'un conseil. **Chapitre II : Du recteur** **** **Article 6
:** Chaque université est placée sous la direction d'un recteur nommé par
dahir, choisi parmi les professeurs de l'université, sur proposition de
l'autorité gouvernementale chargée de l'enseignement supérieur. Le recteur
assure l'exécution des décisions de l'autorité gouvernementale chargée de
l'enseignement supérieur en matière d'enseignement et de recherche
scientifique. Il assure la coordination, en liaison avec le conseil de
l'université, des activités des établissements universitaires. **Article 7 :**
Le recteur accomplit ou autorise tous actes ou opérations relatifs à
l'université et agit en son nom. Il représente l'université vis-à-vis des
tiers et fait tous actes conservatoires ; il est habilité à ester en justice.
Il accepte les dons et les legs faits au profit de l'université sans charges,
conditions ou affectations immobilières et ne soulevant pas d'opposition de la
part de la famille du bienfaiteur. Dans le cas où un don ou legs est fait avec
charges, conditions ou affectations immobilières ou donne lieu à réclamation
des familles son acceptation ou son refus est prononcé par arrêté conjoint du
ministre des finances et de l'autorité gouvernementale chargée de
l'enseignement supérieur. **Article 8 :** Le recteur assure la gestion des
services du rectorat et des services communs de l'université sur lesquels il a
autorité. Il est assisté pour l'administration du rectorat, d'un secrétaire
général et d'un personnel administratif. **Article 9 :** Le rectorat de chaque
université comprend, outre le secrétariat général, des services dont le nombre
et les attributions sont fixés par arrêté de l'autorité gouvernementale
chargée de l'enseignement supérieur sur proposition du recteur. **Article 10
:** Le secrétaire général de l'université est nommé par arrêté de l'autorité
gouvernementale chargée de l'enseignement supérieur parmi les fonctionnaires
classés au moins à l'échelle de classement n° 10 prévue par le décret n°
2-73-722 du 10 hija 1393 (31 décembre 1973) fixant les échelles de classement
des fonctionnaires de l'Etat et la hiérarchie des emplois supérieurs des
administrations publiques. **Chapitre III : De la gestion financière de
l'université** **** **Article 11 :******(1er alinéa modifié par la loi n°
39-95 promulguée par le dahir n° 1-95-247 du 12 ramadan 1416 (2 février 1996)
; par le dahir n° 1-00-260 du 2 joumada II 1421 (1er septembre 2000)) Les
prévisions budgétaires de l'université sont établies pour un an débutant le
1er janvier de chaque année et s'achevant le 31 décembre de l'année suivante.
Elles comportent une section relative aux recettes et aux dépenses afférentes
aux services communs du rectorat et autant de sections qu'il y a
d'établissements universitaires. Chaque section retrace les recettes et les
dépenses qui sont propres aux services communs ou aux établissements
universitaires à l'exception des dépenses qui restent à la charge du ministère
de tutelle, telles qu'elles seront fixées par arrêté conjoint de l'autorité
gouvernementale chargée de l'enseignement supérieur et du ministre des
finances. **Article 12 :** Les prévisions budgétaires concernant les services
communs de l'université sont établies par le recteur. Les prévisions
budgétaires afférentes à chaque établissement universitaire sont établies par
le chef de l'établissement qui les soumet pour examen au conseil de
l'établissement. (3° alinéa modifié par la loi n° 39-95 promulguée par le
dahir n° 1-95-247 du 12 ramadan 1416 (2 février 1996)) Avant le 31 décembre,
l'ensemble de ces prévisions est présenté pour avis par le recteur au conseil
de l'université, puis soumis à l'appréciation du ministre de tutelle qui le
présente à l'approbation du ministre des finances. **Article 13 :** Le recteur
est ordonnateur de la section relative aux dépenses et recettes des services
communs du rectorat de l'université ; chaque chef d'établissement
universitaire est ordonnateur de la section relative à l'établissement qu'il
dirige. Les conditions financières et comptables selon lesquelles sont
exécutées les dépenses et recettes relatives à ces sections sont fixées par
arrêté du ministre des finances. L'université et les établissements
universitaires sont soumis au contrôle financier prévu par le dahir du 17
chaoual 1379 (14 avril 1960) organisant le contrôle financier de l'Etat sur
les offices établissements publics et sociétés concessionnaires ainsi que sur
les sociétés et organismes bénéficiant du concours financier de l'Etat ou de
collectivités publiques. **Article 14 :** Les établissements universitaires
sont habilités à percevoir des droits correspondant aux services rendus par
lesdits établissements, droits d'inscription notamment, dont la liste et le
montant sont fixés par décret pris sur proposition du ministre des finances et
de l'autorité gouvernementale chargée de l'enseignement supérieur. **Chapitre
IV : Du conseil de l'université** **** **Article 15 :** Il est institué auprès
de chaque université un conseil dit « Conseil de l'université ». **Article 16
:** Le conseil de l'université comprend :  _* des membres de droit :_ \- le
recteur ;  \- les doyens des facultés et les directeurs des écoles ; \- les
directeurs des instituts spécialisés :  \- les vice-doyens des facultés et les
directeurs adjoints des écoles. _* des membres élus :_ \- un professeur de
l'enseignement supérieur, un maître de conférences, un maître-assistant et un
assistant par établissement, élus pour une durée de deux ans par leurs pairs
du même cadre ;  \- deux étudiants par établissement, élus par les étudiants
de l'établissement concerné pour une durée de deux ans. _*des membres désignés
:_ \- huit membres désignés par l'autorité gouvernementale chargée de
l'enseignement supérieur après avis du recteur, parmi les personnalités qui
s'intéressent à l'enseignement supérieur ou celles ayant de hautes
responsabilités dans les différents secteurs de l'économie nationale ;  \- un
représentant désigné par l'autorité gouvernementale chargée du plan ;  \- un
représentant désigné par l'autorité gouvernementale chargée de la formation
des cadres. Tout membre du conseil de l'université cesse de faire partie de ce
conseil s'il perd la qualité pour laquelle il a été élu ou désigné. Le
secrétariat du conseil est assuré par le secrétaire général de l'université.
**Article 17 :** Le conseil de l'université a pour fonctions :  1° de procéder
à des études relatives à l'amélioration du niveau de l'enseignement, à son
adaptation aux besoins du pays, à l'amélioration de la pédagogie et de ses
méthodes et au développement de la recherche scientifique ;  2° de donner son
avis sur les programmes d'enseignement et de recherche présentés à son examen
;  3° de donner son avis sur les prévisions budgétaires concernant
l'université ; le conseil formule ensuite les propositions qui sont soumises
par le recteur à l'autorité gouvernementale chargée de l'enseignement
supérieur ;  4° de donner son avis sur les recrutements sur titres et la
titularisation de l'ensemble du personnel enseignant-chercheur proposés par la
commission scientifique de chaque établissement ;  5° de donner son avis sur
l'avancement de ce personnel sur proposition de la même commission, à
l'exclusion des enseignants-chercheurs appelés à exercer des fonctions
administratives ou toute autre mission au service central des ministères de
l'enseignement supérieur et de la santé publique ;  6° à l'égard de l'ensemble
du personnel enseignant-chercheur, le conseil siège en qualité de conseil de
discipline dans les formes et conditions prévues par décret. Dans l'exercice
des fonctions visées aux paragraphes 4, 5 et 6 ci-dessus, le conseil de
l'université se réunit hors la présence des représentants des étudiants et des
membres désignés. Dans l'exercice de ces mêmes fonctions, la composition du
conseil est modifiée de telle façon qu'en aucun cas un fonctionnaire d'un
grade donné ne soit appelé à formuler une proposition concernant un
fonctionnaire d'un grade hiérarchique supérieur. En tout état de cause, les
fonctionnaires dont la situation est soumise à l'examen du conseil ne peuvent
prendre part aux délibérations. Le conseil de l'université élabore le
règlement intérieur de l'université qui est soumis par le recteur à
l'approbation de l'autorité gouvernementale chargée de l'enseignement
supérieur. **Article 18 :** Le conseil de l'université peut établir, après
accord de l'autorité gouvernementale chargée de l'enseignement supérieur, des
relations de coopération avec d'autres universités ou des organismes
s'occupant de l'enseignement ou de la recherche. **Article 19 :** Le recteur
est président du conseil de l'université. En cas d'empêchement ou d'absence,
les fonctions du recteur sont assurées par un doyen désigné par l'autorité
gouvernementale chargée de l'enseignement supérieur. **Article 20 :** Le
conseil de l'université se réunit sur convocation de son président deux fois
par an au moins et chaque fois que les circonstances l'exigent. Sur la
première convocation, le conseil ne peut délibérer valablement que si plus de
la moitié de ses membres sont présents. Si ce quorum n'est pas atteint, une
deuxième réunion peut être valablement tenue sans condition de quorum, à huit
jours d'intervalle. Les délibérations du conseil de l'université sont prises à
la majorité des présents. En cas de partage égal des voix, celle du président
est prépondérante. **Titre II : Des établissements universitaires** ****
**Chapitre Premier : Création et composition** **** **Article 21 :** Les
établissements universitaires sont placés sous la direction d'un doyen ou
directeur et dotés d'un conseil. Ils préparent aux diplômes nationaux relevant
de leur spécialité. Ces diplômes sont signés par le chef d'établissement et
visés par le recteur de l'université. Les instituts spécialisés sont placés
sous la direction d'un directeur et réalisent les travaux de recherche de leur
compétence. **Article 22 :** Les établissements universitaires se composent de
départements d'enseignement et de recherche créés par arrêté de l'autorité
gouvernementale chargée de l'enseignement supérieur pris après avis du recteur
sur proposition du chef d'établissement. Toutefois, la création des
départements relevant des facultés de médecine et pharmacie est prise par
arrêté conjoint de l'autorité gouvernementale chargée de l'enseignement
supérieur et du ministre de la santé publique. **Article 23 :** Les
attributions et les modalités de fonctionnement des départements sont fixées
par arrêté de l'autorité gouvernementale chargée de l'enseignement supérieur.
**Chapitre II : De la direction des établissements universitaires** ****
**Article 24 :** Les doyens des facultés, les directeurs des écoles et les
directeurs des instituts sont nommés par dahir sur proposition de l'autorité
gouvernementale chargée de l'enseignement supérieur. Le doyen de la faculté ou
le directeur de l'école est choisi parmi les professeurs de l'enseignement
supérieur. Le directeur de l'institut est choisi parmi les professeurs de
l'enseignement supérieur ou les maîtres de conférences ou parmi les personnes
compétentes de formation universitaire. **Article 25 :** Le doyen d'une
faculté et le directeur d'une école sont secondés respectivement d'un vice-
doyen et d'un directeur adjoint, nommés parmi les professeurs de
l'enseignement supérieur ou les maîtres de conférences par arrêté de
l'autorité gouvernementale chargée de l'enseignement supérieur, sur
proposition du responsable de l'établissement et après avis du recteur.
**Article 26 :** Les chefs d'établissements ont autorité sur les services
administratifs relevant de leur établissement et qui comprennent, outre un
secrétariat général, des services dont le nombre et les attributions sont
fixés par arrêté de l'autorité gouvernementale chargée de l'enseignement
supérieur, après avis du recteur, sur proposition du chef d'établissement. Le
secrétaire général est nommé par arrêté de l'autorité gouvernementale chargée
de l'enseignement supérieur parmi les fonctionnaires classés au moins à
d'échelle de classement n° 10 prévue par le décret n° 2-73-722 du 10 hija 1393
(31 décembre 1973) fixant les échelles de classement des fonctionnaires de
l'Etat et la hiérarchie des emplois supérieurs des administrations publiques.
**Chapitre III : Du conseil de l'établissement** **** **Article 27 :** Il est
institué auprès de chaque établissement universitaire un conseil de faculté,
un conseil de l'école ou un conseil de l'institut. **Article 28 :** Le conseil
de faculté, de l'école ou de l'institut comprend :  _*des membres de droit :_
\- le doyen de la faculté ou le directeur de l'école ou de l'institut,
président ;  \- le vice-doyen de la faculté ou le directeur adjoint de l'école
;  \- les professeurs de l'enseignement supérieur exerçant dans
l'établissement.  _*des membres élus :_ \- les chefs des départements ;  \-
trois maîtres de conférences, deux maîtres-assistants et un assistant élus
pour une durée de deux ans par leurs pairs du même cadre ;  \- trois étudiants
élus pour une durée de deux ans par les étudiants de l'établissement. _* des
membres désignés :_ \- deux personnes s'intéressant aux formations dispensées
par l'établissement et choisies pour une période de deux ans par le recteur,
sur proposition du responsable de l'établissement. Tout membre du conseil
cesse d'en faire partie s'il perd la qualité pour laquelle il a été élu ou
désigné. Le secrétaire général de l'établissement assure le secrétariat du
conseil. **Article 29 :** Le conseil de l'établissement examine les prévisions
budgétaires soumises à son avis. Il est saisi, à titre consultatif, de toutes
les questions relatives :  \- à l'organisation des enseignements et à la
pédagogie ;  \- aux programmes d'enseignement et de recherche ;  \- au
fonctionnement de l'établissement. A cet effet, il est saisi de rapports
d'activités des départements et habilité à proposer toutes mesures propres à
contribuer au développement et au rayonnement de la vie scientifique dans
l'établissement. **Article 30 :** Le conseil de l'établissement siège en
qualité de conseil de discipline à l'égard des étudiants, dans les formes et
conditions prévues par décret. **Article 31 :** Le conseil de l'établissement
se réunit au moins trois fois par an sur convocation de son président. Sur la
première convocation, le conseil ne peut délibérer valablement que si plus de
la moitié de ses membres sont présents. Si ce quorum n'est pas atteint, une
deuxième réunion peut être valablement tenue, sans condition de quorum, à huit
jours d'intervalle. Les délibérations du conseil de l'établissement sont
prises à la majorité des présents. En cas de partage égal des voix, celle du
président est prépondérante. **Titre III : Dispositions diverses et
transitoires** **** **Article 32 :** Le statut du personnel enseignant-
chercheur et du personnel administratif et technique des universités est fixé
par décret. De même sont fixés par décret les programmes d'enseignement et les
régimes des études et examens. **Article 33 :** Les modalités d'élection au
conseil de l'université et au conseil de l'établissement sont déterminées par
arrêté de l'autorité gouvernementale chargée de l'enseignement supérieur.
**Article 34 :** Sont abrogées toutes dispositions contraires au présent dahir
portant loi et notamment le dahir n° 1-58-390 du 15 moharrem 1379 (21 juillet
1959) portant création et organisation de l'Université de Rabat et le dahir n°
1-62-249 du 12 ramadan 1382 (6 février 1963) portant réorganisation de
l'Université Quaraouyine. Les textes relatifs aux régimes des études et des
examens pris en application du dahir n° 1-58-390 du 15 moharrem 1379 (21
juillet 1959) portant création et organisation de l'Université de Rabat et du
dahir n° 1-62-249 du 12 ramadan 1382 (6 février 1963) portant réorganisation
de l'Université Quaraouyine sont maintenus en vigueur. **Article 35 :** Le
présent dahir portant loi sera publié au _Bulletin officiel._ _Fait à Fès, le
13 safar 1395 (25 février 1975)._ Pour contreseing :  
_Le Premier ministre,  
_**Ahmed Osman.** ****

 ### Source: URL: https://juridiahackhaton.blob.core.windows.net/fine-tuning/documents/7490.html type: Dahir date_publication: 1975-02-25 title: Dahir portant loi n° 1-75-102 du 13 safar 1395 (25 février 1975) relatif à l'organisation des universités."
