Question,Answer,Context
"ما هي الآليات التي يعتمدها ""لجنة التوجيه"" لضمان التزام البنك المركزي الشعبي والبنوك الشعبية الجهوية بأحكام القانون المتعلق بمؤسسات الائتمان والهيئات المعتبرة في حكمها؟","بالرجوع إلى النص القانوني المقدم، فإن ""لجنة التوجيه"" تعتمد الآليات التالية لضمان التزام البنك المركزي الشعبي والبنوك الشعبية الجهوية بأحكام القانون المتعلق بمؤسسات الائتمان والهيئات المعتبرة في حكمها:

1.  **ممارسة الرقابة الإدارية والتقنية والمالية:** تمارس اللجنة رقابة شاملة على تنظيم وإدارة البنك المركزي الشعبي وكل بنك شعبي جهوي. هذه الرقابة تشمل الجوانب الإدارية والتقنية والمالية لضمان سير العمليات وفقًا للقوانين واللوائح.

2.  **التأكد من احترام القوانين:** تتأكد اللجنة من التزام هذه المؤسسات بأحكام القانون رقم 12-96 المتعلق بإصلاح القرض الشعبي للمغرب، وكذلك القانون المتعلق بمؤسسات الائتمان والهيئات المعتبرة في حكمها، بالإضافة إلى النصوص التطبيقية لهذه القوانين.

3.  **اتخاذ التدابير اللازمة:** يحق للجنة اتخاذ جميع التدابير الضرورية لضمان حسن سير عمل مؤسسات القرض الشعبي للمغرب، والحفاظ على توازنها المالي، ومعالجة أي صعوبات قد تواجهها البنوك المعنية.

4.  **مراجعة محاضر الاجتماعات:** تتلقى اللجنة محاضر اجتماعات الجمعيات العمومية ومجالس الإدارة ومجالس الرقابة لهذه المؤسسات، ولها الحق في طلب إعادة المداولة في أي قرار قبل تنفيذه.

5.  **تحديد النسب المالية:** تقوم اللجنة بتحديد نسب مالية معينة بين عناصر الأصول والخصوم والتزامات التوقيع لكل من البنك المركزي الشعبي والبنوك الشعبية الجهوية، وذلك لضمان سلامة الوضع المالي لهذه المؤسسات.

6.  **الموافقة المسبقة على بعض العمليات:** يجب على مؤسسات القرض الشعبي للمغرب الحصول على موافقة مسبقة من ""لجنة التوجيه"" قبل القيام ببعض العمليات مثل:
    *   تأسيس بنوك شعبية جهوية جديدة.
    *   اندماج بنكين أو أكثر من البنوك الشعبية الجهوية.
    *   استيعاب بنك أو أكثر من البنوك الشعبية الجهوية من قبل بنك آخر أو من قبل البنك المركزي الشعبي.
    *   نقل جزء من الأصول والخصوم بين البنوك الشعبية الجهوية.
    *   القيام باستثمارات في رؤوس أموال مؤسسات ائتمانية أخرى.
    *   إنشاء فروع أو وكالات أو مكاتب تمثيل.

7.  **إجراء عمليات التفتيش:** تقوم اللجنة بإجراء عمليات تفتيش ميدانية ووثائقية على مؤسسات القرض الشعبي للمغرب وفروعها، إما عن طريق جهاز التفتيش العام التابع لها أو عن طريق أي شخص آخر تكلفه بذلك.

8.  **إبلاغ نتائج التفتيش:** تقوم اللجنة بإبلاغ مجالس الإدارة أو مجالس الرقابة في المؤسسات المعنية بنتائج عمليات التفتيش، والتوصيات التي تراها ضرورية لتحسين الإدارة والحفاظ على الملاءة المالية.

باختصار، ""لجنة التوجيه"" تلعب دورًا رقابيًا وإشرافيًا فعالًا لضمان التزام مؤسسات القرض الشعبي للمغرب بالقوانين واللوائح المنظمة لعملها، وذلك من خلال مجموعة من الآليات التي تشمل الرقابة الإدارية والمالية، والتأكد من احترام القوانين، واتخاذ التدابير اللازمة، والموافقة المسبقة على بعض العمليات، وإجراء عمليات التفتيش، وإبلاغ نتائج التفتيش.
","### Context: ---  
**Bulletin officiel n° 4840 du 19 octobre 2000**  
**EDITION DE TRADUCTION OFFICIELLE**  
****  
**Dahir n° 1-00-70 du 19 rejeb 1421 (17 octobre 2000) portant promulgation de
la loi n° 12-96 portant réforme du Crédit populaire du Maroc.** **** ****
**LOUANGE A DIEU SEUL !** **__** _(Grand Sceau de Sa Majesté Mohammed VI)_ __
Que l'on sache par les présentes - puisse Dieu en élever et en fortifier la
teneur ! Que Notre Majesté Chérifienne, Vu la constitution, notamment ses
articles 26 et 58, **** **A Décidé ce qui suit :** **** Est promulguée et sera
publiée au Bulletin officiel, à la suite du présent dahir, la loi n° 12-96
portant réforme du crédit populaire du Maroc, adoptée par la chambre des
représentants et la Chambre des conseillers. _Fait à Casablanca, le 19 rejeb
1421 (17 octobre 2000)._ Pour contreseing :  _Le Premier ministre,_
**Abderrahman Youssoufi.** **** ***** *** *** **** **Loi n° 12-96 portant
réforme du Crédit populaire du Maroc** **** **Chapitre premier : Définition et
objet du Crédit populaire du Maroc** **** **Article premier :** Le Crédit
populaire du Maroc est un groupement de banques constitué par la Banque
centrale populaire et les banques populaires régionales. Il est placé sous la
tutelle d'un comité dénommé Comité directeur du Crédit populaire du Maroc.
Peuvent être placées sous le contrôle du Crédit populaire du Maroc des
sociétés à caractère mutualiste ou coopératif ayant pour objet de cautionner
leurs membres à raison de leurs engagements. Le Crédit populaire du Maroc est
notamment chargé de favoriser l'activité et le développement de toute
entreprise moyenne ou petite, artisanale, industrielle ou de service par la
distribution de crédits à court, moyen et long termes. Il contribue à la
mobilisation de l'épargne, à son utilisation au niveau des régions où elle est
collectée et à la promotion des activités bancaires au niveau local et
régional. **** **Chapitre II : Du Comité directeur du Crédit populaire du
Maroc** **** **Section I : Les attributions du Comité directeur** ****
**Article 2 :** (modifié par l'article premier de la loi n° 77-14 promulguée
par le dahir n° 1-15-78 du 14 ramadan 1436 (le' juillet 2015)) Le Comité
directeur du Crédit populaire du Maroc, ci-après appelé Comité directeur est
chargé :  \- de définir les orientations générales du Crédit populaire du
Maroc ; \- d'exercer un contrôle administratif, technique et financier sur
l'organisation et la gestion de la Banque centrale populaire et de chaque
banque populaire régionale et en particulier de veiller au respect par ces
organismes des dispositions de la présente loi et de celles de la loi relative
aux établissements de crédit et organismes assimilés, et des textes pris pour
leur application, telles qu'elles leur sont applicables ; \- de prendre toutes
les mesures nécessaires au bon fonctionnement des organismes du Crédit
populaire du Maroc et à la sauvegarde de leur équilibre financier et au
redressement éventuel des banques concernées ; \- de représenter
collectivement les organismes du Crédit populaire du Maroc pour faire valoir
leurs droits et intérêts communs ; \- de définir et contrôler les règles de
fonctionnement communes au Crédit populaire du Maroc **Article 3 :** (modifié
par l'article premier de la loi n° 44-08 promulguée par le dahir n° 1-10-154
du 13 ramadan 1431 (24 août 2010) ,  modifié par l'article premier de la loi
n° 32-20 promulguée par le dahir n° 1-20-87 du 25 rabii II 1442 (11 décembre
2020)) Le Comité directeur a pour attributions : 1.- d'approuver les
règlements intérieurs des organismes du Crédit populaire du Maroc ainsi que
les modifications susceptibles de leur être apportées ; 2.- de soumettre à
l'agrément du Wali de Bank Al-Maghrib dans les conditions prévues par la loi
relative aux établissements de crédit et organismes assimilés :  a) la
création de banques populaires régionales ; b) la fusion de deux ou plusieurs
banques populaires régionales ; c) l'absorption d'une ou plusieurs banque(s)
populaire(s) régionale(s) par une autre banque populaire régionale ou par la
Banque centrale populaire. 3.-  (abrogé par l'article 4 de la loi n° 44-08
promulguée par le dahir n° 1-10-154 du 13 ramadan 1431 (24 août 2010)) ; 4.-
de décider, après accord des banques populaires régionales concernées, le
transfert partiel entre elles de leurs actif et passif. Le Comité directeur
fixe, dans ce cas, les conditions du transfert ; 5 -  (abrogé par l'article
premier de la loi n° 77-14 promulguée par le dahir n° 1-15-78 du 14 ramadan
1436 (le' juillet 2015)) ; 6.- d'établir le statut applicable au personnel du
Crédit populaire du Maroc ; 7.- d'administrer le fonds de soutien du Crédit
populaire du Maroc, prévu au chapitre V ci-après, dont la gestion est assurée
par la Banque centrale populaire et en déterminer les modalités de
financement, d'utilisation et en approuver le règlement intérieur ; 8.-
d'arrêter annuellement la proportion des résultats de chacun des organismes du
Crédit populaire du Maroc à affecter au fonds de soutien, nonobstant la
contribution prévue à l'article 28 ci-après ; 9.- de déterminer les plafonds
du capital des banques populaires régionales et les prix de souscription et de
rachat des parts sociales ordinaires qui le composent ainsi que le taux de
participation de la Banque centrale populaire dans le capital de chacune des
banques populaires régionales et ce, sans préjudice des dispositions de
l'article 23 ci-après ; 10.- d'établir le statut-type des banques populaires
régionales et de donner son avis sur les statuts de la Banque centrale
populaire. Le Comité directeur donne son avis sur toute modification
susceptible d'être apportée auxdits statuts et statut-type. **Article 4 :** Le
Comité directeur ratifie la nomination des présidents et vice-présidents des
conseils de surveillance des banques populaires régionales ainsi que celle des
membres de leurs directoires. La non ratification doit être motivée. Dans ce
cas, le conseil de surveillance de l'organisme concerné est tenu de réviser
ses décisions et de s'en référer à la plus prochaine assemblée générale.
**Article 5 :** Les organismes du Crédit populaire du Maroc sont tenus de
communiquer au Comité directeur les procès-verbaux des réunions de leurs
assemblées, de leur conseil d'administration et de leurs conseils de
surveillance. Le Comité directeur peut demander à ces organes de procéder à
une seconde délibération de toute décision ou résolution préalablement à sa
mise en exécution. **Article 6 :** Le Comité directeur détermine : \- la liste
des services d'intérêt commun aux organismes du Crédit populaire du Maroc
ainsi que les modalités du financement et de gestion desdits services ; \- le
programme annuel des actions visant à promouvoir et à consolider le
sociétariat au niveau des banques populaires régionales ainsi que les
modalités de leur financement ; \- les modalités d'alimentation et de gestion
du budget destiné à financer les frais d'administration et de fonctionnement
le concernant ; \- les normes, les procédures et les conditions de financement
des budgets de fonctionnement et d'investissement que doivent respecter les
banques populaires régionales et la Banque centrale populaire. **Article 7 :**
(abrogé et remplacé par l'article unique de la loi n° 42-07 promulguée par le
dahir n° 1-08-86 du 20 chaoual 1429 (20 octobre 2008)) Le comité directeur
fixe :  \- les niveaux au-delà desquels les banques populaires régionales
doivent verser leurs excédents de trésorerie à la Banque centrale populaire,
les modalités de gestion de ces excédents, ainsi que les conditions de leur
rémunération en rapport avec celles du marché ; \- le niveau et les modalités
de refinancement des banques populaires régionales dans des conditions de
rémunération en rapport avec celles du marché. \- Le comité directeur approuve
les émissions d'emprunts à long terme par les organismes du Crédit populaire
du Maroc.  **Article 8 :** Le Comité directeur statue sur les crédits de
toutes sortes que les organismes du Crédit populaire du Maroc consentent aux
membres de leur conseil d'administration, de leurs conseils de surveillance et
de leurs directoires. **Article 9 :** (modifié par l'article premier de la loi
n° 77-14 promulguée par le dahir n° 1-15-78 du 14 ramadan 1436 (le' juillet
2015)) Sans préjudice des dispositions de la loi relative aux établissements
de crédit et organismes assimilés, le Comité directeur fixe, pour la Banque
centrale populaire et pour chaque banque populaire régionale, des rapports
déterminés entre des éléments de l'actif et l'ensemble ou certains éléments du
passif et des engagements par signature. **Article 10 :** (modifié par
l'article premier de la loi n° 77-14 promulguée par le dahir n° 1-15-78 du 14
ramadan 1436 (le' juillet 2015 ,  abrogé et remplacé par l'article 2 de la loi
n° 32-20 promulguée par le dahir n° 1-20-87 du 25 rabii II 1442 (11 décembre
2020)) Le Comité directeur soumet à l'accord préalable du Wali de Bank Al-
Maghrib :  \- les prises de participation des organismes du Crédit populaire
du Maroc dans le capital aboutissant ou non à un contrôle d'un autre
établissement de crédit ; \- la création de filiales, de succursales ou de
bureaux de représentation. **Article 11 :** Le Comité directeur peut charger
la Banque centrale populaire de la mise en œuvre des décisions qu'il prend en
vertu de ses attributions. Il peut également créer tous comités ou commissions
dont il définit l'étendue des attributions qu'il tient lui même de la présente
loi, leur composition et les modalités de leur fonctionnement. Les décisions
du Comité directeur obligent les organismes du crédit populaire du Maroc. ****
**Section II : Composition et fonctionnement du Comité directeur** ****
**Article 12 :** (modifié par l'article premier de la loi n° 44-08 promulguée
par le dahir n° 1-10-154 du 13 ramadan 1431 (24 août 2010) ,  modifié par
l'article premier de la loi n° 32-20 promulguée par le dahir n° 1-20-87 du 25
rabii II 1442 (11 décembre 2020)) Le Comité directeur comprend outre son
président :  \- quatre présidents des conseils de surveillance des banques
populaires régionales élus par leurs pairs ;  \- quatre représentants du
conseil d'administration de la Banque centrale populaire nommés par ledit
conseil. \- quatre membres indépendants désignés par le comité directeur. Le
président du comité directeur peut appeler toute personne, dont la présence
est jugée utile, à participer, à titre consultatif, aux réunions de ce comité
**Article 13 :** (modifié par l'article premier de la loi n° 44-08 promulguée
par le dahir n° 1-10-154 du 13 ramadan 1431 (24 août 2010)) La durée du mandat
des membres du comité directeur ainsi que les modalités de leur élection sont
fixées par le règlement intérieur de ce comité. **Article 14 :** (modifié par
l'article premier de la loi n° 32-20 promulguée par le dahir n° 1-20-87 du 25
rabii II 1442 (11 décembre 2020)) Le Comité directeur délibère valablement
lorsque sept au moins de ses membres sont présents. Ses décisions sont prises
à la majorité des membres présents. En cas de partage égal des voix, celle du
président est prépondérante. Le secrétariat du Comité directeur est assuré par
la Banque centrale populaire. **Article 15 :** (modifié par l'article premier
de la loi n° 77-14 promulguée par le dahir n° 1-15-78 du 14 ramadan 1436 (1er
juillet 2015)) Le Comité directeur élabore et approuve son règlement
intérieur. **** **Chapitre III : De la Banque centrale populaire** ****
**Article 16 :** (abrogé et remplacé par l'article 2 de la loi n° 77-14
promulgué par le dahir n° 1-15-78 du 14 ramadan 1436 (1er juillet 2015)) La
Banque centrale populaire est une banque sous forme de société anonyme à
conseil d'administration et à capital fixe régie par la présente loi, par la
loi n° 17-95 relative aux sociétés anonymes et par la loi relative aux
établissements de crédit et organismes assimilés. Les statuts de la Banque
centrale populaire ainsi que les modifications qui peuvent leur être
apportées, sont établis conformément à la loi n° 17-95 relative aux sociétés
anonymes, après accord du comité directeur **Article 17 :** (abrogé et
remplacé par l'article unique de la loi n° 42-07 promulguée par le dahir n°
1-08-86 du 20 chaoual 1429 (20 octobre 2008) ,  modifié par l'article premier
de la loi n° 77-14 promulguée par le dahir n° 1-15-78 du 14 ramadan 1436 (1er
juillet 2015) ,  modifié par l'article premier de la loi n° 32-20 promulguée
par le dahir n° 1-20-87 du 25 rabii II 1442 (11 décembre 2020)) Le capital
social de la Banque centrale populaire est détenu à hauteur d'au moins 34% par
les banques populaires régionales. Toute autre personne morale ne peut
détenir, directement ou indirectement, une part supérieure à 15% dans le
capital de la Banque centrale populaire et toute personne physique ne peut
détenir une part supérieure à 5% dudit capital **Article 18 :** (modifié par
l'article premier de la loi n° 77-14 promulguée par le dahir n° 1-15-78 du 14
ramadan 1436 (1er juillet 2015)) La Banque centrale populaire est habilitée à
effectuer toutes les opérations susceptibles d'être pratiquées par les banques
en vertu des dispositions de la loi relative aux établissements de crédit et
organismes assimilés. Toutefois, elle ne peut intervenir directement dans les
circonscriptions territoriales où les banques populaires régionales exercent
leurs activités, qu'en accord avec la banque populaire régionale concernée. En
cas de conflit, le Comité directeur statue **Article 19 :** (abrogé et
remplacé par l'article 3 de la loi n° 44-08 promulguée par le dahir n°
1-10-154 du 13 ramadan 1431 (24 août 2010) ,  abrogé par l'article 3 de la loi
n° 77-14 promulguée par le dahir n° 1-15-78 du 14 ramadan 1436 (1er juillet
2015)) **Article 20 :** Sous réserve des attributions dévolues au Comité
directeur par la présente loi, le Conseil d'administration de la Banque
centrale populaire est investi de tous les pouvoirs nécessaires à
l'administration et à la gestion de la banque tels qu'ils sont prévus par la
loi n° 17-95 relative aux sociétés anonymes. **Article 21 :** (modifié par
l'article premier de la loi n° 44-08 promulguée par le dahir n° 1-10-154 du 13
ramadan 1431 (24 août 2010) ,  par l'article premier de la loi n° 77-14
promulguée par le dahir n° 1-15-78 du 14 ramadan 1436 (1er juillet 2015)) La
Banque centrale populaire est l'organisme central bancaire des banques
populaires régionales ; à ce titre, elle est chargée :  \- de la compensation
des créances et des dettes réciproques des organismes du Crédit populaire du
Maroc ;  \- du refinancement des banques populaires régionales, dans les
conditions fixées par le Comité directeur ;  \- de la centralisation des
souscriptions de valeurs mobilières, publiques ou privées, recueillies par les
organismes du Crédit populaire du Maroc ;  \- de la gestion, selon les
modalités fixées par le Comité directeur :  \- des excédents de Trésorerie des
banques populaires régionales ; \- des services d'intérêt commun aux
organismes du Crédit populaire du Maroc \- du fonds de soutien du Crédit
populaire du Maroc dont elle élabore le règlement intérieur et le soumet à
l'approbation du Comité directeur ;  \- de la centralisation des déclarations
de toute nature vis-à-vis de Bank AI-Maghrib, de l'administration et des
organismes professionnels ;  \- d'effectuer toute mission qui est confiée par
le Comité directeur, en application des dispositions de l'article 11 ci-
dessus. **Article 21 bis :** (ajouté par l'article 2 de la loi n° 44-08
promulguée par le dahir n° 1-10-154 du 13 ramadan 1431 (24 août 2010)) La
Banque centrale populaire consolide les comptes des organismes du Crédit
populaire du Maroc et de leurs filiales. Pour l'élaboration de ses comptes
consolidés, l'entité consolidante est constitué des organismes du crédit
populaire du Maroc. **** **Chapitre IV : Des banques populaires régionales**
**** **Article 22 :** (modifié par l'article premier de la loi n° 77-14
promulguée par le dahir n° 1-15-78 du 14 ramadan 1436 (1er juillet 2015)) Les
banques populaires régionales sont des banques de forme coopérative à capital
variable, à directoire et à conseil de surveillance. Elles sont régies par la
présente loi, par les dispositions de la loi relative aux établissements de
crédit et organismes assimilés et par les dispositions relatives aux sociétés
anonymes à capital variable édictées par le dahir du 17 hija 1340 (11 août
1922) relatif aux sociétés de capitaux à l'exception des dérogations prévues à
l'article 23 ci-après ainsi que par leurs statuts **Article 23 :** (abrogé et
remplacé par l'article 2 de la loi n° 77-14 promulguée par le dahir n° 1-15-78
du 14 ramadan 1436 (1er juillet 2015)) Le capital des banques populaires
régionales est constitué de parts sociales ordinaires réservées aux
sociétaires et de parts sociales privilégiées réservées à la Banque centrale
populaire et aux banques populaires régionales. Les parts sociales ordinaires
sont souscrites à la valeur nominale de la part sociale prévue par le statut-
type des banques populaires régionales et ne donnent droit qu'à une
rémunération dont la valeur annuelle et le mode de calcul sont fixés par le
comité directeur. Les parts sociales privilégiées sont souscrites sur la base
de la valeur de chaque banque populaire régionale dont la méthode d'évaluation
est fixée par le Comité directeur pour chaque banque populaire régionale
conformément aux normes en vigueur en matière d'évaluation des banques. Elles
donnent droit aux bénéfices et aux réserves de chacune desdites banques
populaires régionales. A tout moment, les parts sociales privilégiées doivent
représenter au moins 51% du capital de chaque banque populaire régionale.
Lesdites parts sociales privilégiées donnent droit au vote dans les assemblées
générales proportionnellement au capital détenu dans chaque banque populaire
régionale. **Article 24 :** (modifié par l'article premier de la loi n° 77-14
promulguée par le dahir n° 1-15-78 du 14 ramadan 1436 (1er juillet 2015)) Les
statuts des banques populaires régionales doivent être conformes au statut-
type élaboré par le Comité directeur. Ce statut-type doit préciser, en
particulier :  \- la circonscription territoriale de la banque concernée ;  \-
les rôles et les attributions du conseil de surveillance et du directoire tels
qu'ils sont prévus aux articles 77 à 106 de la loi n° 17-95 relative aux
sociétés anonymes ;  \- les modalités d'élection des membres du conseil de
surveillance ;  \- les modalités de nomination des membres et du président du
directoire par le conseil de surveillance ;  \- le nombre des membres du
conseil de surveillance qui doit être compris entre trois et douze ;  \- la
durée du mandat des membres du conseil de surveillance laquelle ne peut être
supérieure à six ans ;  \- la durée du mandat des membres du directoire
laquelle ne peut être supérieure à six ans ;  \- les règles qui doivent être
appliquées lors des modifications du capital, des prises de participations
dans d'autres banques populaires régionales, de la modification des statuts et
de la liquidation ;  \- les droits des sociétaires et leurs obligations ;  \-
les conditions d'adhésion et de retrait des sociétaires ;  \- le mode
d'affectation des résultats ;  \- la rémunération de la part sociale
ordinaire. **Article 25 :** Les banques populaires régionales peuvent
effectuer toutes les opérations de banque dans leurs circonscriptions
territoriales respectives, conformément à la présente loi, à leurs statuts et
à leurs règlements intérieurs, sous réserve des prérogatives dévolues au
comité directeur par la présente loi. Elles peuvent également effectuer des
opérations dans d'autres circonscriptions territoriales, en accord avec la ou
les banques populaires régionales concernées. En cas de différend, le comité
directeur statue. **Article 26 :** Les banques populaires régionales ne
peuvent se refinancer, notamment sous forme d'avances de toute nature,
qu'auprès de la Banque centrale populaire, sauf dérogation accordée par le
comité directeur. **** **Chapitre V : Du fonds de soutien du Crédit populaire
du Maroc** **** **Article 27 :** (modifié par l'article premier de la loi n°
77-14 promulguée par le dahir n° 1-15-78 du 14 ramadan 1436 (1er juillet
2015)) Afin de préserver notamment la solvabilité des organismes du Crédit
populaire du Maroc, il est créé un Fonds de soutien du Crédit populaire du
