Question,Answer,Context
du Maroc dans le capital aboutissant ou non à un contrôle d'un autre
établissement de crédit ; \- la création de filiales, de succursales ou de
bureaux de représentation. **Article 11 :** Le Comité directeur peut charger
la Banque centrale populaire de la mise en œuvre des décisions qu'il prend en
vertu de ses attributions. Il peut également créer tous comités ou commissions
dont il définit l'étendue des attributions qu'il tient lui même de la présente
loi, leur composition et les modalités de leur fonctionnement. Les décisions
du Comité directeur obligent les organismes du crédit populaire du Maroc. ****
**Section II : Composition et fonctionnement du Comité directeur** ****
**Article 12 :** (modifié par l'article premier de la loi n° 44-08 promulguée
par le dahir n° 1-10-154 du 13 ramadan 1431 (24 août 2010) ,  modifié par
l'article premier de la loi n° 32-20 promulguée par le dahir n° 1-20-87 du 25
rabii II 1442 (11 décembre 2020)) Le Comité directeur comprend outre son
président :  \- quatre présidents des conseils de surveillance des banques
populaires régionales élus par leurs pairs ;  \- quatre représentants du
conseil d'administration de la Banque centrale populaire nommés par ledit
conseil. \- quatre membres indépendants désignés par le comité directeur. Le
président du comité directeur peut appeler toute personne, dont la présence
est jugée utile, à participer, à titre consultatif, aux réunions de ce comité
**Article 13 :** (modifié par l'article premier de la loi n° 44-08 promulguée
par le dahir n° 1-10-154 du 13 ramadan 1431 (24 août 2010)) La durée du mandat
des membres du comité directeur ainsi que les modalités de leur élection sont
fixées par le règlement intérieur de ce comité. **Article 14 :** (modifié par
l'article premier de la loi n° 32-20 promulguée par le dahir n° 1-20-87 du 25
rabii II 1442 (11 décembre 2020)) Le Comité directeur délibère valablement
lorsque sept au moins de ses membres sont présents. Ses décisions sont prises
à la majorité des membres présents. En cas de partage égal des voix, celle du
président est prépondérante. Le secrétariat du Comité directeur est assuré par
la Banque centrale populaire. **Article 15 :** (modifié par l'article premier
de la loi n° 77-14 promulguée par le dahir n° 1-15-78 du 14 ramadan 1436 (1er
juillet 2015)) Le Comité directeur élabore et approuve son règlement
intérieur. **** **Chapitre III : De la Banque centrale populaire** ****
**Article 16 :** (abrogé et remplacé par l'article 2 de la loi n° 77-14
promulgué par le dahir n° 1-15-78 du 14 ramadan 1436 (1er juillet 2015)) La
Banque centrale populaire est une banque sous forme de société anonyme à
conseil d'administration et à capital fixe régie par la présente loi, par la
loi n° 17-95 relative aux sociétés anonymes et par la loi relative aux
établissements de crédit et organismes assimilés. Les statuts de la Banque
centrale populaire ainsi que les modifications qui peuvent leur être
apportées, sont établis conformément à la loi n° 17-95 relative aux sociétés
anonymes, après accord du comité directeur **Article 17 :** (abrogé et
remplacé par l'article unique de la loi n° 42-07 promulguée par le dahir n°
1-08-86 du 20 chaoual 1429 (20 octobre 2008) ,  modifié par l'article premier
de la loi n° 77-14 promulguée par le dahir n° 1-15-78 du 14 ramadan 1436 (1er
juillet 2015) ,  modifié par l'article premier de la loi n° 32-20 promulguée
par le dahir n° 1-20-87 du 25 rabii II 1442 (11 décembre 2020)) Le capital
social de la Banque centrale populaire est détenu à hauteur d'au moins 34% par
les banques populaires régionales. Toute autre personne morale ne peut
détenir, directement ou indirectement, une part supérieure à 15% dans le
capital de la Banque centrale populaire et toute personne physique ne peut
détenir une part supérieure à 5% dudit capital **Article 18 :** (modifié par
l'article premier de la loi n° 77-14 promulguée par le dahir n° 1-15-78 du 14
ramadan 1436 (1er juillet 2015)) La Banque centrale populaire est habilitée à
effectuer toutes les opérations susceptibles d'être pratiquées par les banques
en vertu des dispositions de la loi relative aux établissements de crédit et
organismes assimilés. Toutefois, elle ne peut intervenir directement dans les
circonscriptions territoriales où les banques populaires régionales exercent
leurs activités, qu'en accord avec la banque populaire régionale concernée. En
cas de conflit, le Comité directeur statue **Article 19 :** (abrogé et
remplacé par l'article 3 de la loi n° 44-08 promulguée par le dahir n°
1-10-154 du 13 ramadan 1431 (24 août 2010) ,  abrogé par l'article 3 de la loi
n° 77-14 promulguée par le dahir n° 1-15-78 du 14 ramadan 1436 (1er juillet
2015)) **Article 20 :** Sous réserve des attributions dévolues au Comité
directeur par la présente loi, le Conseil d'administration de la Banque
centrale populaire est investi de tous les pouvoirs nécessaires à
l'administration et à la gestion de la banque tels qu'ils sont prévus par la
loi n° 17-95 relative aux sociétés anonymes. **Article 21 :** (modifié par
l'article premier de la loi n° 44-08 promulguée par le dahir n° 1-10-154 du 13
ramadan 1431 (24 août 2010) ,  par l'article premier de la loi n° 77-14
promulguée par le dahir n° 1-15-78 du 14 ramadan 1436 (1er juillet 2015)) La
Banque centrale populaire est l'organisme central bancaire des banques
populaires régionales ; à ce titre, elle est chargée :  \- de la compensation
des créances et des dettes réciproques des organismes du Crédit populaire du
Maroc ;  \- du refinancement des banques populaires régionales, dans les
conditions fixées par le Comité directeur ;  \- de la centralisation des
souscriptions de valeurs mobilières, publiques ou privées, recueillies par les
organismes du Crédit populaire du Maroc ;  \- de la gestion, selon les
modalités fixées par le Comité directeur :  \- des excédents de Trésorerie des
banques populaires régionales ; \- des services d'intérêt commun aux
organismes du Crédit populaire du Maroc \- du fonds de soutien du Crédit
populaire du Maroc dont elle élabore le règlement intérieur et le soumet à
l'approbation du Comité directeur ;  \- de la centralisation des déclarations
de toute nature vis-à-vis de Bank AI-Maghrib, de l'administration et des
organismes professionnels ;  \- d'effectuer toute mission qui est confiée par
le Comité directeur, en application des dispositions de l'article 11 ci-
dessus. **Article 21 bis :** (ajouté par l'article 2 de la loi n° 44-08
promulguée par le dahir n° 1-10-154 du 13 ramadan 1431 (24 août 2010)) La
Banque centrale populaire consolide les comptes des organismes du Crédit
populaire du Maroc et de leurs filiales. Pour l'élaboration de ses comptes
consolidés, l'entité consolidante est constitué des organismes du crédit
populaire du Maroc. **** **Chapitre IV : Des banques populaires régionales**
**** **Article 22 :** (modifié par l'article premier de la loi n° 77-14
promulguée par le dahir n° 1-15-78 du 14 ramadan 1436 (1er juillet 2015)) Les
banques populaires régionales sont des banques de forme coopérative à capital
variable, à directoire et à conseil de surveillance. Elles sont régies par la
présente loi, par les dispositions de la loi relative aux établissements de
crédit et organismes assimilés et par les dispositions relatives aux sociétés
anonymes à capital variable édictées par le dahir du 17 hija 1340 (11 août
1922) relatif aux sociétés de capitaux à l'exception des dérogations prévues à
l'article 23 ci-après ainsi que par leurs statuts **Article 23 :** (abrogé et
remplacé par l'article 2 de la loi n° 77-14 promulguée par le dahir n° 1-15-78
du 14 ramadan 1436 (1er juillet 2015)) Le capital des banques populaires
régionales est constitué de parts sociales ordinaires réservées aux
sociétaires et de parts sociales privilégiées réservées à la Banque centrale
populaire et aux banques populaires régionales. Les parts sociales ordinaires
sont souscrites à la valeur nominale de la part sociale prévue par le statut-
type des banques populaires régionales et ne donnent droit qu'à une
rémunération dont la valeur annuelle et le mode de calcul sont fixés par le
comité directeur. Les parts sociales privilégiées sont souscrites sur la base
de la valeur de chaque banque populaire régionale dont la méthode d'évaluation
est fixée par le Comité directeur pour chaque banque populaire régionale
conformément aux normes en vigueur en matière d'évaluation des banques. Elles
donnent droit aux bénéfices et aux réserves de chacune desdites banques
populaires régionales. A tout moment, les parts sociales privilégiées doivent
représenter au moins 51% du capital de chaque banque populaire régionale.
Lesdites parts sociales privilégiées donnent droit au vote dans les assemblées
générales proportionnellement au capital détenu dans chaque banque populaire
régionale. **Article 24 :** (modifié par l'article premier de la loi n° 77-14
promulguée par le dahir n° 1-15-78 du 14 ramadan 1436 (1er juillet 2015)) Les
statuts des banques populaires régionales doivent être conformes au statut-
type élaboré par le Comité directeur. Ce statut-type doit préciser, en
particulier :  \- la circonscription territoriale de la banque concernée ;  \-
les rôles et les attributions du conseil de surveillance et du directoire tels
qu'ils sont prévus aux articles 77 à 106 de la loi n° 17-95 relative aux
sociétés anonymes ;  \- les modalités d'élection des membres du conseil de
surveillance ;  \- les modalités de nomination des membres et du président du
directoire par le conseil de surveillance ;  \- le nombre des membres du
conseil de surveillance qui doit être compris entre trois et douze ;  \- la
durée du mandat des membres du conseil de surveillance laquelle ne peut être
supérieure à six ans ;  \- la durée du mandat des membres du directoire
laquelle ne peut être supérieure à six ans ;  \- les règles qui doivent être
appliquées lors des modifications du capital, des prises de participations
dans d'autres banques populaires régionales, de la modification des statuts et
de la liquidation ;  \- les droits des sociétaires et leurs obligations ;  \-
les conditions d'adhésion et de retrait des sociétaires ;  \- le mode
d'affectation des résultats ;  \- la rémunération de la part sociale
ordinaire. **Article 25 :** Les banques populaires régionales peuvent
effectuer toutes les opérations de banque dans leurs circonscriptions
territoriales respectives, conformément à la présente loi, à leurs statuts et
à leurs règlements intérieurs, sous réserve des prérogatives dévolues au
comité directeur par la présente loi. Elles peuvent également effectuer des
opérations dans d'autres circonscriptions territoriales, en accord avec la ou
les banques populaires régionales concernées. En cas de différend, le comité
directeur statue. **Article 26 :** Les banques populaires régionales ne
peuvent se refinancer, notamment sous forme d'avances de toute nature,
qu'auprès de la Banque centrale populaire, sauf dérogation accordée par le
comité directeur. **** **Chapitre V : Du fonds de soutien du Crédit populaire
du Maroc** **** **Article 27 :** (modifié par l'article premier de la loi n°
77-14 promulguée par le dahir n° 1-15-78 du 14 ramadan 1436 (1er juillet
2015)) Afin de préserver notamment la solvabilité des organismes du Crédit
populaire du Maroc, il est créé un Fonds de soutien du Crédit populaire du
Maroc dénommé ci-après Fonds de soutien et ce, sans préjudice des dispositions
de la loi relative aux établissements de crédit et organismes assimilés.
**Article 28 :** Sont tenus de participer au financement du Fonds de soutien
tous les organismes du Crédit populaire du Maroc et ce, par le versement d'une
contribution annuelle fixée par le Comité directeur sans que cette
contribution excède 2% du chiffre d'affaires desdits organismes. **Article 29
:** (modifié par l'article premier de la loi n° 77-14 promulguée par le dahir
n° 1-15-78 du 14 ramadan 1436 (1er juillet 2015)) Le Fonds de soutien est
destiné : \- à octroyer au profit des organismes du Crédit populaire du Maroc
des avances exceptionnelles remboursables ou des subventions ;  \- à
consentir, dans le cadre d'un plan de restructuration agréé par le Comité
directeur, à l'organisme du Crédit populaire du Maroc se trouvant en
difficulté, des concours remboursables ;  \- à octroyer, aux organismes du
Crédit populaire du Maroc, des dotations devant servir à la constitution de
provisions destinées à faire face à des risques susceptibles d'affecter la
rentabilité ou la solidité des organismes du Crédit populaire du Maroc,
notamment les risques de crédit ;  \- à renforcer les fonds propres de base
des organismes du Crédit populaire du Maroc dans les limites et conditions
fixées par le règlement intérieur du Fonds de soutien. **  
Article 30 :** Au cas où les moyens financiers visés à l'article précédent
sont insuffisants pour redresser la situation financière dudit organisme, les
autres organismes du Crédit populaire du Maroc doivent apporter leur
contribution à son assainissement. \- Cette contribution revêt, la forme de
concours remboursables dont les conditions sont déterminées par le Comité
directeur en fonction notamment des ressources, des emplois et de la
rentabilité desdits organismes. **** **Chapitre VI : Du contrôle du Crédit
populaire du Maroc par le Comité directeur** **** **Article 31 :** (modifié
par l'article premier de la loi n° 77-14 promulguée par le dahir n° 1-15-78 du
14 ramadan 1436 (1er juillet 2015)) Afin de permettre au Comité directeur
d'assurer sa mission de contrôle des organismes du Crédit populaire du Maroc
et sans préjudice des dispositions de la loi relative aux établissements de
crédit et organismes assimilés, le Comité directeur fait procéder, par le
corps de l'inspection générale qui lui est attaché ou par toute autre personne
qu'il commissionne à cet effet, à des contrôles sur place et sur pièces des
organismes du Crédit populaire du Maroc et de leurs filiales **Article 32 :**
Les organismes du Crédit populaire du Maroc et leurs filiales sont tenus de
communiquer aux personnes chargées des contrôles sur place visés à l'article
31 ci-dessus, tous documents et renseignements nécessaires à l'accomplissement
de leurs missions. **Article 33 :** Le Comité directeur communique au conseil
d'administration ou au conseil de surveillance de l'organisme du Crédit
populaire du Maroc concerné les résultats des contrôles sur place et les
redressements de toute nature qu'il juge utiles à la bonne gestion et à la
sauvegarde de la solvabilité dudit organisme ou au bon fonctionnement du
Crédit populaire du Maroc. **** **Chapitre VII : Du contrôle de l'Etat** ****
**Article 34 :** (abrogé par l'article 3 de la loi n° 77-14 promulguée par le
dahir n° 1-15-78 du 14 ramadan 1436 (1er juillet 2015)) **Article 35 :**
(abrogé par l'article 3 de la loi n° 77-14 promulguée par le dahir n° 1-15-78
du 14 ramadan 1436 (1er juillet 2015)) **Article 36 :** (abrogé par l'article
3 de la loi n° 77-14 promulguée par le dahir n° 1-15-78 du 14 ramadan 1436
(1er juillet 2015)) **Article 37 :** (abrogé par l'article 3 de la loi n°
77-14 promulguée par le dahir n° 1-15-78 du 14 ramadan 1436 (1er juillet
2015)) **Article 38 :** (abrogé par l'article 3 de la loi n° 77-14 promulguée
par le dahir n° 1-15-78 du 14 ramadan 1436 (1er juillet 2015)) **Article 39
:** (abrogé par l'article 3 de la loi n° 77-14 promulguée par le dahir n°
1-15-78 du 14 ramadan 1436 (1er juillet 2015)) **** **Chapitre VIII :
Sanctions disciplinaires et pénales** **** **Section I : Sanctions
disciplinaires** **** **Article 40 :** (abrogé par l'article 3 de la loi n°
77-14 promulguée par le dahir n° 1-15-78 du 14 ramadan 1436 (1er juillet
2015)) Sans préjudice des dispositions de la loi relative aux établissements
de crédit et organismes assimilés, les membres du conseil d'administration,
des conseils de surveillance et des directoires du Crédit populaire du Maroc
qui contreviennent aux dispositions de la présente loi et des textes pris pour
son application sont passibles des sanctions prévues ci-après. **Article 41
:** Lorsqu'un membre du conseil d'administration, du conseil de surveillance
ou du directoire d'un organisme du Crédit populaire du Maroc n'observe pas les
obligations qui lui incombent en vertu de la présente loi, le Comité
directeur, après l'avoir mis en demeure de respecter ces obligations, peut lui
adresser une mise en garde. **Article 42 :** Dans le cas où la mise en garde
prévue à l'article précédent reste sans effet, le Comité directeur peut
adresser audit membre un avertissement. **Article 43 :** Si l'avertissement
visé à l'article 42 ci-dessus demeure sans résultat, le Comité directeur peut,
par décision motivée susceptible de recours devant les tribunaux, prononcer la
suspension du membre du conseil d'administration, du conseil de surveillance
ou du directoire concerné. Pour assurer le bon fonctionnement de l'organisme
du Crédit populaire du Maroc concerné, le Comité directeur convoque dans un
délai de quinze jours (15) soit le conseil d'administration ou le conseil de
surveillance, soit l'assemblée générale en vue de procéder à la nomination
d'un nouveau membre du directoire ou à l'élection d'un nouveau membre du
conseil d'administration ou du conseil de surveillance. **** **Section II :
Sanctions pénales** **** **Article 44 :** Est punie d'un emprisonnement de
trois mois à un an et d'une amende de 20.000 à 200.000 dirhams ou de l'une de
ces deux peines seulement, toute personne qui, agissant pour son propre compte
ou pour le compte d'une personne morale : \- utilise indûment une dénomination
commerciale, une raison sociale et d'une manière générale toute expression
faisant croire qu'elle fait partie des organismes du Crédit populaire du Maroc
ou qu'elle en émane ; \- entretient sciemment dans l'esprit du public une
confusion sur son appartenance aux organismes du Crédit populaire du Maroc ou
à leurs émanations. Le tribunal ordonne, également, la fermeture de
l'établissement où l'infraction a été commise et la publication du jugement
dans les journaux qu'il désigne, aux frais du condamné. **Article 45 :** Les
auteurs des infractions définies à l'article précédent, leurs coauteurs ou
complices peuvent être poursuivis sur plainte préalable ou constitution de
partie civile de l'organisme du Crédit populaire du Maroc concerné. ****
**Chapitre IX : Des mesures diverses et transitoires** **** **Article 46 :**
(abrogé par l'article 3 de la loi n° 77-14 promulguée par le dahir n° 1-15-78
du 14 ramadan 1436 (1er juillet 2015)) **Article 47 :** (abrogé par l'article
3 de la loi n° 77-14 promulguée par le dahir n° 1-15-78 du 14 ramadan 1436
(1er juillet 2015)) **Article 48 :** (abrogé par l'article 3 de la loi n°
77-14 promulguée par le dahir n° 1-15-78 du 14 ramadan 1436 (1er juillet
2015)) **Article 49 :** (abrogé par l'article 3 de la loi n° 77-14 promulguée
par le dahir n° 1-15-78 du 14 ramadan 1436 (1er juillet 2015)) **Article 50
:** (abrogé par l'article 3 de la loi n° 77-14 promulguée par le dahir n°
1-15-78 du 14 ramadan 1436 (1er juillet 2015)) **Article 51 :** (abrogé par
l'article 3 de la loi n° 77-14 promulguée par le dahir n° 1-15-78 du 14
ramadan 1436 (1er juillet 2015)) **Article 52 :** (abrogé et remplacé par
l'article 2 de la loi n° 77-14 promulguée par le dahir n° 1-15-78 du 14
ramadan 1436 (1er juillet 2015)) Les banques populaires régionales qui
refusent d'adapter leurs statuts au statut- type prévu à l'article 24 ci-
dessus, dans un délai de 12 mois à compter de la date d'approbation dudit
statut-type, sont exclues du Crédit populaire du Maroc et doivent procéder
immédiatement au remboursement des avances de toute nature qu'elles auraient
reçues des autres organismes du Crédit populaire du Maroc et du Fonds de
soutien. Elles doivent solliciter, selon les modalités prévues par la loi
relative aux établissements de crédit et organismes assimilés, un nouvel
agrément d'exercer leurs activités en qualité de banque **Article 53 :** Les
sociétés à caractère mutualiste ou coopératif visées à l'article premier ci-
dessus peuvent être à capital fixe ou variable et constituer tous fonds
responsables et de garantie affectés à la sûreté de leurs engagements.
**Article 54 :** (abrogé et remplacé par l'article 2 de la loi n° 77-14
promulguée par le dahir n° 1-15-78 du 14 ramadan 1436 (1er juillet 2015 ,
abrogé par l'article 3 de la loi n° 32-20 promulguée par le dahir n° 1-20-87
du 25 rabii II 1442 (11 décembre 2020)) **Article 55 :** (abrogé et remplacé
par l'article unique de la loi n° 42-07 promulguée par le dahir n° 1-08-86 du
20 chaoual 1429 (20 octobre 2008) ,  modifié par l'article premier de la loi
n° 32-20 promulguée par le dahir n° 1-20-87 du 25 rabii II 1442 (11 décembre
2020)) La Banque centrale populaire met à la disposition des banques
populaires régionales, le personnel de gestion nécessaire à leur bon
fonctionnement. Le personnel de gestion des banques populaires régionales et
de la Banque centrale populaire relève, pour ce qui concerne sa mobilité, son
appréciation, son avancement et ses sanctions, du Comité directeur. Le
règlement intérieur du Comité directeur fixe les catégories du personnel de
direction concernées. **Article 56 :** (abrogé par l'article 3 de la loi n°
77-14 promulguée par le dahir n° 1-15-78 du 14 ramadan 1436 (1er juillet
2015)) **Article 57 :** (abrogé par l'article 3 de la loi n° 77-14 promulguée
par le dahir n° 1-15-78 du 14 ramadan 1436 (1er juillet 2015)) **Article 58
:** (abrogé par l'article 3 de la loi n° 77-14 promulguée par le dahir n°
1-15-78 du 14 ramadan 1436 (1er juillet 2015)) **Article 59 :** (modifié par
l'article unique de la loi n° 57-00 promulguée par le dahir n° 1-00-357 du 29
ramadan 1421 (26 décembre 2000) ,  abrogé par l'article 3 de la loi n° 77-14
promulguée par le dahir n° 1-15-78 du 14 ramadan 1436 (1er juillet 2015))
**Article 60 :** La loi n° 24-83 fixant le statut général des coopératives et
les missions de l'Office du développement de la coopération, telle qu'elle a
été modifiée ou complétée n'est pas applicable aux organismes du Crédit
populaire du Maroc. Sont abrogées les dispositions du dahir n° 1-60-232 du 16
chaabane 1380 (2 février 1961) portant réforme du Crédit populaire du Maroc,
tel qu'il a été modifié ou complété. ****

 ### Source: URL: https://juridiahackhaton.blob.core.windows.net/fine-tuning/documents/8576.html type: Dahir date_publication: 2000-10-17 title: Dahir n° 1-00-70 du 19 rejeb 1421 (17 octobre 2000) portant promulgation de la loi n° 12-96 portant réforme du Crédit populaire du Maroc."
"ما هي الإجراءات التي تتخذها ""لجنة التوجيه"" في حالة عدم امتثال أحد أعضاء مجالس الإدارة أو المراقبة أو المديرين لأحكام القانون، وما هي العقوبات التأديبية الممكنة؟","بالتأكيد، سأقدم لك إجابة مفصلة بناءً على النص القانوني الذي قدمته:

**إجراءات لجنة التوجيه في حالة عدم امتثال أحد الأعضاء:**

وفقًا للمادة 41 وما يليها من القانون رقم 12-96 المتعلق بإصلاح القرض الشعبي للمغرب، فإن لجنة التوجيه تتخذ الإجراءات التالية في حالة عدم امتثال أحد أعضاء مجالس الإدارة أو المراقبة أو المديرين لأحكام القانون:

1.  **الإعذار:** تبدأ اللجنة بتوجيه إعذار للعضو المخالف، تطالبه فيه بالامتثال لأحكام القانون. هذا الإعذار يعتبر بمثابة تنبيه رسمي.

2.  **التنبيه:** إذا لم يستجب العضو للإعذار، تقوم اللجنة بتوجيه تنبيه رسمي له. هذا التنبيه يعتبر تصعيدًا للإجراءات التأديبية.

3.  **التوقيف:** إذا لم يلتزم العضو بالتنبيه، يحق للجنة التوجيه، بعد اتخاذ قرار معلل وقابل للطعن أمام المحاكم، أن تصدر قرارًا بتوقيف العضو المخالف عن ممارسة مهامه.

4.  **الدعوة لتعيين بديل:** بعد قرار التوقيف، تقوم اللجنة بدعوة مجلس الإدارة أو مجلس المراقبة أو الجمعية العامة (حسب الحالة) في غضون 15 يومًا لتعيين أو انتخاب عضو جديد ليحل محل العضو الموقوف.

**العقوبات التأديبية الممكنة:**

بناءً على الإجراءات المذكورة أعلاه، فإن العقوبات التأديبية التي يمكن أن تفرضها لجنة التوجيه على أعضاء مجالس الإدارة أو المراقبة أو المديرين المخالفين هي:

*   **الإعذار:** وهو بمثابة تنبيه رسمي للعضو المخالف.
*   **التنبيه:** وهو تصعيد للإجراءات التأديبية في حالة عدم استجابة العضو للإعذار.
